video_id,title,published_at,channel_id,channel_title,tags,view_count,likes,dislikes,comment_count,thumbnail_link,comments_disabled,ratings_disabled,description,category_name
iViFbBbvENU,I Let The FAMILY In Front Of Me Choose What I Eat For 24 Hours!,2023-11-12T22:00:18.000Z,UC6huXz0F6-7KA7-mW0jdejA,ErikTheElectric,erik the electric|erik the electric food challenge|erik the electric eating challenge|erik the electric letting the person in front of me decide what i eat challenge|erik the electric letting the family in front of me decide what i eat challenge|fast food challenge,1962282,125208,0,3406,https://i.ytimg.com/vi/iViFbBbvENU/default.jpg,False,False,"The Letting the person in front of me decide what I eat challenge has been done countless times over the last few years, but in this food challenge I attempt to let the family in front of me decide what I eat at every fast food restaurant I visit! This 24 hour high calorie was absolutely insane for the fact that I had to go to many fast food places! Be sure to stick around to see if I was able to complete this one! Subscribe: https://www.youtube.com/c/ErikTheElectric?sub_confirmation=1 Get I Heart Carbs Merch: https://eriktheelectric.shop/collections/tank-tops/products/i-3-carbs-tank-topWatch Me Eat The World's Heaviest Woman's Diet: https://youtu.be/QrtWMm1dxbYWatch Me Eat 100,000 Calories: https://youtu.be/OSK4fPC966sWatch More Erik TheElectric:Cheat Days: https://youtube.com/playlist?list=PLEutRp8s1YDjTOlEXWa-tCw9B2YphwzjORestaurant Challenges: https://youtube.com/playlist?list=PLEutRp8s1YDg88pWYAlnX_tnpL9yvIhC5Popular Videos: https://www.youtube.com/playlist?list=PLEutRp8s1YDjcT2LlO0NA-_AjJ4ZLpUS2Latest Uploads: https://www.youtube.com/playlist?list=PLEutRp8s1YDjjOfhb-poGHsykhkZyrEKwErik’s 2nd Channel: @TheElectrics Erik’s 3rd Channel:   @ElectricTalks #foodchallenge #caloriechallenge I'm Erik. I specialize in high calorie food challenges. Whether it’s a massive 10,000 calorie burger, or it’s me attempting to eat the entire menu of a fast food restaurant. My goal is always to succeed in whatever food adventure I find myself in. If you love calorie packed food challenges, be sure to follow along and subscribe to the channel!",Entertainment
VWavstJydZU,Inside Out 2 | Teaser Trailer,2023-11-09T13:59:01.000Z,UC_IRYSp4auq7hKLvziWVH6w,Pixar,Pixar|Disney|Disney Pixar|Pixar Movie|Animation,12957429,337784,0,16754,https://i.ytimg.com/vi/VWavstJydZU/default.jpg,False,False,"🚧Things are getting messy🚧Disney and Pixar's #InsideOut2 is coming to theaters June 2024 with brand new emotions!The little voices inside Riley’s head know her inside and out—but next summer, everything changes when Disney and Pixar’s “Inside Out 2” introduces a new Emotion: Anxiety. According to director Kelsey Mann, the new character promises to stir things up within headquarters. “Anxiety, voiced by Maya Hawke, might be new to the crew, but she’s not really the type to take a back seat,” said Mann. “That makes a lot of sense if you think about it in terms of what goes on inside all our minds.” A trailer, poster and film stills are now available for what promises to be the feel-good (or feel-everything) film of Summer 2024. Disney and Pixar’s “Inside Out 2” returns to the mind of newly minted teenager Riley just as headquarters is undergoing a sudden demolition to make room for something entirely unexpected: new Emotions! Joy, Sadness, Anger, Fear and Disgust, who’ve long been running a successful operation by all accounts, aren’t sure how to feel when Anxiety shows up. And it looks like she’s not alone. Maya Hawke lends her voice to Anxiety, alongside Amy Poehler as Joy, Phyllis Smith as Sadness, Lewis Black as Anger, Tony Hale as Fear, and Liza Lapira as Disgust. Directed by Kelsey Mann and produced by Mark Nielsen, “Inside Out 2” releases only in theaters Summer 2024.",Film & Animation
nxdh69enoSw,Traveling to the Strangest Country on Earth,2023-11-12T18:01:06.000Z,UCvK4bOhULCpmLabd2pDMtnA,Yes Theory,yestheory|seek discomfort|yes theory strangers|yes theory travel|yes theory subscribers|getting out of your comfort zone|Amazon FBA,1596597,82882,0,19680,https://i.ytimg.com/vi/nxdh69enoSw/default.jpg,False,False,"Visit http://magictravel.ai/yestheory to enter to win 1 of 3 Dream trips valued at $7,000 each. Thanks to Magic for Sponsoring this Video.Thank you to Young Pioneer Tours for taking us on this incredible trip. Links to their details here :) :https://www.youngpioneertours.com/🙏🏼 Thank you for making these videos possible through your support of Seek Discomfort ⚡️ Support our work at: http://seek-discomfort.com/yes-theorySpecial thanks to  @CorySMartin for the INCREDIBLE visuals - go check out his work!Giveaway terms and conditions apply. Visit https://www.magictravel.ai/yestheorygiveawayterms for details.JOIN OUR COMMUNITY⁺ Seek Discomfort: https://www.youtube.com/seekdiscomfort📝 Follow Matt’s Newsletter: http://yestheory.com/newsletter/📸 Instagram -  https://www.instagram.com/yestheory/🐦 Twitter - https://twitter.com/yestheory🎬  Facebook- https://www.facebook.com/yestheory/☮️ If you want to join the Yes Fam Facebook group which is 100,000+ of our most engaged and badass community members, you can apply here: https://www.facebook.com/groups/yesfam/🎥 HOW WE MAKE OUR VIDEOS🎵 Where we find our music:1- Epidemic Sound. Amazing royalty free music for YouTube. Free 30 day trial here: http://share.epidemicsound.com/wFFbr  2- Musicbed. Amazing label-quality cinematic music. 30-day free trial here:http://share.mscbd.fm/YesTheory​3- Artlist. 2 Months Free High Quality Music: https://artlist.io/artlist-70446/?artlist_aid=YesTheory_593&utm_source=affiliate_p&utm_medium=YesTheory_593&utm_campaign=YesTheory_5934- Soundstripe: Get 15% off by using the code YESTHEORY at the link https://soundstripe.com?fpr=yestheory🎞 Our b-roll and stock footage:2 Months Free Stock Footage Videos: https://artgrid.io/artgrid-114820/?artlist_aid=YesTheory_593&utm_source=affiliate_p&utm_medium=YesTheory_593&utm_campaign=YesTheory_593For an amazing b-roll and footage library, checkout: http://storyblocks.com/YesTheory​📈  Our Most Popular YouTube Videos🎬  Traveling to the least visited country in the world: https://youtu.be/ODuEl4oNae0🎬  Becoming Superhuman with Iceman Wim Hof: https://youtu.be/8cvhwquPqJ0🎬  We Helicopter Bungee Jumped with Will Smith: https://youtu.be/KSu6gRp7UBA🎙 The Yes Theory Podcast: https://spoti.fi/3sFdq6vGET IN TOUCH🌍 Our website -  http://www.yestheory.com 🌍 Advertise With Us - partnerships@yestheory.com Who are we? We believe that life’s greatest moments and deepest connections exist outside of your comfort zone.Ask us a Question:Tweet us @yestheory",Entertainment
iZRwPq_MXJ0,X-Raying Until This Server Bans Me,2023-11-12T14:30:17.000Z,UCX_OYNnlNv3vQWiER4b0f5w,Yeah Jaron,haha|funy|sily|humerus,775950,26339,0,699,https://i.ytimg.com/vi/iZRwPq_MXJ0/default.jpg,False,False,"I've found a way to X-Ray on Minecraft servers UNDETECTED. Time to not do anything nefarious with this at all xDAlso, here is the link to some of @ThatChiefGuy's videos, you probably want to watch them because of how funny he was in this video. Where I get my music: https://share.epidemicsound.com/30xq36(music list coming soon when I feel like it)BananaMan590 Theme: The I of It - Title ScreenDiscord: https://discord.gg/WRbeVp3Twitter: https://twitter.com/Yeah_JaronOne thing I do while recording/editing videos is listen to music. But I've found a playlist of different songs to be too distracting, so I've started listening to one song on repeat for hours. It helps me focus, so I thought it would be fun to share the songs I listened to each time.Recording: Mrs. Stately's Garden - Frankie VallieEditing: Clay Sun Graham KartnaI'm not kidding, I've listened to both these songs like 300 times.",Gaming
HTcL9WkB_wg,Passenger - Let Her Go (Feat. Ed Sheeran - Anniversary Edition) [Official Video],2023-11-10T12:00:11.000Z,UCFHtCB_FWXQ8GpjgfYcD8-g,Passenger,Let Her Go|Ed Sheeran|Acoustic|Home|Lyrics|acoustic|busking|guitar|Holes|covers songs|only know you love her|passnger|let her go lyrics|passengers|passanger|the passenger|pasenger|passenger lyrics|passenger songs|passenger live|Sword From The Stone|sword from the stone|gingerbread mix|passenger 2023|let her go ed sheeran|ed sheeran|ed sheeran passenger|passenger ed sheeran|ed sheeran let her go|let her go anniversary|let her go anniversary edition,5611075,288983,0,6067,https://i.ytimg.com/vi/HTcL9WkB_wg/default.jpg,False,False,Let Her Go (Feat Ed Sheeran - Anniversary Edition)  Stream Now: https://passengermusic.ffm.to/lethergo All The Little Lights ( Anniversary Edition ) Out Now: https://ffm.to/passenger-allthelittlelightsWritten by Mike Rosenberg Featuring Ed Sheeran Produced by Mike Rosenberg & Chris Vallejo Engineered and Mixed by Chris Vallejo Mastered by Bob Ludwig Director: Nic MinnsProducer: Dan MatthewsExec Producer: Alexa HaywoodDoP: Matt GentlemanAudio Producer: Chris VallejoAudio Engineer: Chris Hewitt Production Companies: Just Fred & Ramshackle ProductionsAssist Producer: Ellie ClappertonSteadi: Rich BertenshawHMA: Maria MckennaFocus: Alex RawsonGaffer: Harrison NewmanSpark: Kat ValhallaSpark: Joe KennedyTrainee Spark: Sudiardi SudyonoBTS: Zak WaltersCamera Rental: Unit BagLighting Rental: Jody Street at SHLLocation: Rak StudiosStudio Manager: Emma TownsendStudio Manager: Helen BroadhurstStudio Assist Engineer: Ary MauditStudio Runner: Tendayi MutongerwaEditor: Gregg HoustonColourist: Katie DymockColour Producer: Dan HillsPost House: The MillPassenger Management: Rebekah Tayler at Runaway ManagementPassenger Management: Dan Medland at Runaway ManagementEd Sheeran Tour Management: Ben TaylorBANDMD / KEYS: Leo MunbyGuitar: Daniel VildósolaViolin: Elaine AmbridgeDrums: Alice AnglissCello: Llinos RichardsBass Guitar: Luke Gerber www.passengermusic.com#LetHerGo #EdSheeran #Passenger,Music
vIgnPmmcSXs,skibidi toilet 67 (part 3),2023-11-14T02:00:09.000Z,UCsSsgPaZ2GSmO6il8Cb5iGA,DaFuq!?Boom!,skibidi meme|sfm animation|funny animation|gmod animation|skibidi toilet vs cameramen|titan cameraman|skibidi toilet|scientist skibidi|titan speakerman|titan tvman,45958140,1927331,0,194261,https://i.ytimg.com/vi/vIgnPmmcSXs/default.jpg,False,False,everyone has their weaknessfull-screen versionspecial thanks to @HoovyTube for additional particlesContact me:instagram.com/dafuqboomtvblugrayguy@gmail.com,Entertainment
kpJDfx7oZDo,Peach PRC - Like A Girl Does (Official Music Video),2023-11-14T00:00:08.000Z,UCeIuIf_VikKjjsPthl2nv2g,PeachPRCVEVO,Peach|PRC|Like|Girl|Does|Republic|Records/UMG|Australia/Peach|Pop|peach prc|like girl does|like girl does peach prc|peach prc like girl does|like girl does music video|music video like girl does|peach prc like girl does music video|lesbian anthem|lesbian singer,66718,5417,0,383,https://i.ytimg.com/vi/kpJDfx7oZDo/default.jpg,False,False,"The official “Like A Girl Does” music video by Peach PRC. Listen & download the song here: http://peachprc.lnk.to/likeagirldoesYDFollow Peach: Instagram:  https://instagram.com/peachprc TikTok: https://tiktok.com/@peachprcTwitter: http://twitter.com/peachprcWebsite: http://www.peachprc.comProduced and Directed by Josh Harris @joshharris.auProduction Company: Welcome To The MachinesDOP: David McKinnar1st AC: Bek HawkeyGaffer: Steve Schofield LX Assistant: Alan FraserChoreographer: Mitch WoodcockAssociate Choreographer: Lauren SeymourStylist: Benjamin BatesHair & Makeup Assistant: Jessica JenkinsEdit: Josh HarrisVFX: Joel BenjiColour Grade: Josh HarrisChoreographer: Mitchell Woodcock - New Ground CollectiveAssociate Choreographer: Lauren Seymour  - New Ground CollectiveOfficial Lyrics for Like A Girl DoesThey could never love like a girl doesLike a girl doesBaby put your thigh against just where I likeI wanna get it right let’s do this, do thisGentle with my handsMy tongue it understands your languageCause a man is clueless, cluelessThey want your body, bodyThink you’re a hottie, hottieIt’s nothing but sexualThey’ll never read it, read itKnow how to treat it, treat itNeed that intellectual You know the type, the typical guySwearing he’ll change you if you give him a try(Change you if you give him a try)It doesn’t click, his head’s too thickHe think he’s gonna change your mind with his dick (Ugh, as if)They could never love like a girl doesLike a girl doesLove like a girl doesThey could never fuck like a girl doesLike a girl doesFuck like a girl doesLike honey but sweeterThe grass here is greenerIf god is a woman I’ve seen her, uh ohThey don’t have the touch like a girl doesLike a girl doesTouch like a girl doesCome on over close, I’m taking off my clothesI bet you wanna know so taste it, taste itPretty little pearl, you’re such a good girlIf it’s a man’s world I’ll take it, take itThey want your body, bodyThink you’re a hottie, hottieIt’s nothing but sexualThey’ll never read it, read itKnow how to treat it, treat itNeed that intellectual I’m in the club, he’s acting all toughHe’s showing off thinking he’s picking me up(Thinking that he’s picking me up)He’s tryna pitch, he’s hoping I’ll switchLike I would give this pussy up for a bitch(Ugh, as if)They could never love like a girl doesLike a girl doesLove like a girl doesThey could never fuck like a girl doesLike a girl doesFuck like a girl doesLike honey but sweeterThe grass here is greenerIf god is a woman I’ve seen her, uh ohThey don’t have the touch like a girl doesLike a girl doesTouch like a girl doesThey could never love like a girl doesLike a girl doesThey could never fuck like a girl doesLike a girl does#PeachPRC #LikeAGirlDoesMusic video by Peach PRC performing Like A Girl Does. © 2023 Republic Records, a division of UMG Recordings, Inc.http://vevo.ly/VImcXa",Music
idtvY5lN314,We're Giving Away $30 Million in Free Food,2023-11-12T12:00:29.000Z,UCAiLfjNXkNv24uhpzUgPa6A,Beast Philanthropy,[none],5822593,451732,0,14224,https://i.ytimg.com/vi/idtvY5lN314/default.jpg,False,False,"Thank you to our partner @Ibotta for sponsoring this project, which will help provide equitable access to food for communities in need. Ibotta is taking it one step further – they want to give your family a free meal this Thanksgiving too. Download the Ibotta app to get 100% cash back on turkey and all the essential sides for your holiday dinner. Plus, earn cash back everywhere you shop with the Ibotta app. Download now: https://ibotta.onelink.me/iUfE/z3o7tqs4#ad #IbottaPartner #IbottaThanksgiving                                                                                                                                 (Terms and conditions below)Setting up this operation was very complex and expensive. A huge thank you to the Robin Hood Foundation (https://www.robinhood.org/) for generously helping us to launch this program. We ❤️ you.Sharing Excess is an official partner of Beast Philanthropy. Learn more to get involved at:Website: https://www.sharingexcess.com/Instagram: https://www.instagram.com/sharingexcess/YouTube: https://www.youtube.com/@sharingexcessFood waste statistics provided by ReFED, the global leader in food waste research. Visit their website to learn more. https://refed.org/Many of you have commented on the music in the videos. Did you know that ​⁠​⁠ @DanMace  scores every note in every video with his amazing crew? Now you can enjoy this music on Spotify and, just like the channel, every penny we earn will be put back into the projects we do. (https://open.spotify.com/artist/400iD3n8DqB8wGqxDv6pSB)Follow us so we can help more people together:Instagram: https://www.instagram.com/beastphilanthropy/Website: https://www.beastphilanthropy.orgTiktok: https://www.tiktok.com/@beastphilanthropy Twitter: https://twitter.com/BeastPhilanthr Facebook: ​​https://www.facebook.com/profile.php?id=100084586484118Spotify: https://open.spotify.com/artist/400iD3n8DqB8wGqxDv6pSBBeast Philanthropy Video Disclaimer: This video was produced by Beast Philanthropy Productions, LLC, a North Carolina limited liability company. Any revenue generated for Beast Philanthropy Productions, LLC from this video will be donated to MrCharity, Inc. dba Beast Philanthropy, a North Carolina 501(c)(3) nonprofit corporation. #sponsoredIbotta offer available while supplies last. Qualifying Products and MSRPs may vary. Must be 18 years of age or older, and a US resident. Requires purchase of Qualifying Products  and completed redemptions to get full cash back amount. Check Ibotta to see if the offers are still available. Redemption must be made within 7 days of purchase.  Subject to full terms, available here: https://bit.ly/48DcK7d.Filmed and Edited by:  @DanMace",People & Blogs
BsBNW1VRMUw,BACKYARD BUNKER Part 2 - More than just a Tube...,2023-11-14T15:42:00.000Z,UCWFKCr40YwOZQx8FHU_ZqqQ,JerryRigEverything,Backyard bunker|GroundX Project|GroundX|Secret bunker|secret tunnel|underground bunker|how to build a bunker|how much does a bunker cost|JerryRig Bunker|apocalypse|bunker|off grid|tube bunker,579450,32278,0,1527,https://i.ytimg.com/vi/BsBNW1VRMUw/default.jpg,False,False,"If my backyard bunker is going to survive 250,000 pounds of dirt falling on top of it... it better be strong! Get your own Anker SOLIX F3800 HERE: https://ankerfast.club/17903sd Its a very impressive machine and we would not have been able to finish the bunker tubes without it!! #ankersolix #LIVEINPOWER #Anker #AnkerSOLIXF3800I decided to build a bunker in my backyard because ever since I was a little kid - I though it would be fun to hobbit hole a home out from underground. And TODAY ITS HAPPENING! The massive conduit is finished and ready to be put in the ground. Get my JerryRig Razor knife and GroundX Bunker shirt HERE: https://www.jerryrigknife.com/Follow me for updates! Instagram: http://instagram.com/zacksjerryrig Facebook: http://on.fb.me/1U4bQqv Twitter: https://twitter.com/ZacksJerryRig",Howto & Style
5FqTRXqMYys,"I Made My Friends GUESS THE BUILD.. /w Grian, Joel, Gem, Impulse & Skizz",2023-11-13T17:00:03.000Z,UC6XAct-Bus4x3mYz3VC_HUw,Solidarity,minecraft|minecraft build|minecraft building|minecraft guess the build|guess the build minecraft|minecraft build battle|build battle|minecraft build game|solidaritygaming|skizzleman|grian|smallishbeans|impulsesv|geminitay,198898,14553,0,408,https://i.ytimg.com/vi/5FqTRXqMYys/default.jpg,False,False,"Myself and my friends decided to create and play a chaotic building game and here's how it went..Grian - https://www.youtube.com/watch?v=Q92LYPr7bsMSmallishbeans - https://www.youtube.com/watch?v=TRcr9hvRXc4ImpulseSV - https://www.youtube.com/watch?v=CArhN0w_CUESkizzleman - https://www.youtube.com/watch?v=8e4xwN0pUPoGeminiTay - https://www.youtube.com/watch?v=0dYXAgXiUec🖥 JOIN MY DISCORD!! - https://discord.gg/NX9pGjX🎥 Solidarity VODS - https://www.youtube.com/channel/UCUr59THLl2ZGE98J1QW6dag🎥 Solidarity SHORTS - https://www.youtube.com/channel/UCClclQIBe05V6pV2pj0ckcQ🎥 Solidarity ROBLOX - https://www.youtube.com/channel/UCCRN9HdYcwBFXlCAr0nnS3w📲 SOCIAL MEDIA🐦Twitter - http://bit.ly/SolidarityCoUk📸Instagram - http://bit.ly/InstaSolidarity📱TikTok - https://www.tiktok.com/@solidaritygaming💚 MEMBER |You can also sponsor the channel by heading over to https://www.youtube.com/channel/UC6XA... and clicking the JOIN button. You will gain emoji's in the chat, access to my discord server, and private minecraft server.",Gaming
7XP6AJumPCQ,Chess Pro Answers More Questions From Twitter (ft. GothamChess) | Tech Support | WIRED,2023-11-14T17:00:14.000Z,UCftwRNsjfRo08xYE31tkiyw,WIRED,cheating scandal chess|chess|chess accuracy|chess cheater|chess cheating|chess cheating scandal|chess questions|chess support|currents|elo|gotham chess tech support|gothamchess levy rozman|hans niemann|innovation|less rozman|levy rozman|levy rozman cheating|levy rozman explains chess|magnus carlsen|magnus carlson cheating scandal|ott tech support|science & technology|tech support|tech support chess support|tech support gothamchess|wired,777996,35298,0,1139,https://i.ytimg.com/vi/7XP6AJumPCQ/default.jpg,False,False,"Levy Rozman returns to answer more of the internet's burning questions about the game of chess. What does he make of the Carlsen vs. Neimann controversy? What's the greatest chess move of all time? How are chess bots able to analyze an entire game? Levy answers all these questions and much more!Check out more from Levy Rozman: https://www.youtube.com/channel/UCQHX6ViZmPsWiYSFAyS0a3QDirector: Lisandro Perez-ReyDirector of Photography: Francis BernalEditor: Louville MooreTalent: Levy RozmanLine Producer: Joseph BuscemiAssociate Producer: Paul Gulyas; Brandon WhiteProduction Manager: D. Eric MartinezProduction Coordinator: Fernando DavilaCamera Operator: Brittany BergerGaffer: Mar AlfonsoSound Mixer: Michael GugginoProduction Assistant: Albie SmithPost Production Supervisor: Alexa DeutschPost Production Coordinator: Ian BryantSupervising Editor: Doug LarsenAdditional Editor: Paul TaelAssistant Editor: Billy WardStill haven’t subscribed to WIRED on YouTube? ►► http://wrd.cm/15fP7B7 Listen to the Get WIRED podcast  ►► https://link.chtbl.com/wired-ytc-descWant more WIRED? Get the magazine ►► https://subscribe.wired.com/subscribe/splits/wired/WIR_YouTube?source=EDT_WIR_YouTube_0_Video_Description_ZZFollow WIRED:Instagram ►►https://instagram.com/wiredTwitter ►►http://www.twitter.com/wiredFacebook ►►https://www.facebook.com/wiredTik Tok  ►►https://www.tiktok.com/@wiredGet more incredible stories on science and tech with our daily newsletter: https://wrd.cm/DailyYTAlso, check out the free WIRED channel on Roku, Apple TV, Amazon Fire TV, and Android TV. ABOUT WIREDWIRED is where tomorrow is realized. Through thought-provoking stories and videos, WIRED explores the future of business, innovation, and culture.",Entertainment
7hTgjEzl4Bk,SIDEMEN AMONG US CHAMELEON ROLE: BLEND IN TO WIN,2023-11-09T20:00:03.000Z,UCh5mLn90vUaB1PbRRx_AiaA,MoreSidemen,sidemen|moresidemen|miniminter|ksi|zerkaa|behzinga|tbjzl|vikkstar|wroetoshaw,4328062,183594,0,3225,https://i.ytimg.com/vi/7hTgjEzl4Bk/default.jpg,False,False,🍗: Order food NOW at: https://www.eatsides.com/🎥: Access exclusive content at: https://www.sideplus.com/🍹: XIX Vodka: https://www.xixvodka.com/👉🏻: Subscribe to our Reacts Channel: https://www.youtube.com/SidemenReacts 👈🏻👕: Sidemen Clothing: https://www.sidemenclothing.com📸: Sidemen Instagram: http://www.instagram.com/Sidemen🐤: Sidemen Twitter: http://www.twitter.com/Sidemen▶️ SIDEMEN ◀️🔵 JOSH (Zerkaa)● http://www.youtube.com/Zerkaa● http://www.youtube.com/ZerkaaPlays● http://www.instagram.com/Zerkaa● http://www.twitter.com/ZerkaaHD🔴 HARRY (W2S)● http://www.youtube.com/W2S● http://www.youtube.com/W2SPlays● http://www.instagram.com/Wroetoshaw● http://www.twitter.com/Wroetoshaw🔵 VIK (Vikkstar123)● http://www.youtube.com/Vikkstar123● http://www.youtube.com/Vikkstar123HD● http://www.youtube.com/VikkstarPlays● http://www.instagram.com/Vikkstagram● http://www.twitter.com/Vikkstar123🔴 JJ (KSI)● http://www.youtube.com/KSI● http://www.youtube.com/KSIOlajidebtHD● http://www.instagram.com/KSI● http://www.twitter.com/KSIOlajidebt🔵 TOBI (Tobjizzle)● http://www.youtube.com/TBJZL● http://www.youtube.com/Editingaming● http://www.instagram.com/Tobjizzle● http://www.twitter.com/Tobjizzle🔴 ETHAN (Behzinga)● http://www.youtube.com/Behzinga● http://www.youtube.com/Beh2inga● http://www.instagram.com/Behzingagram● http://www.twitter.com/Behzinga🔵 SIMON (Miniminter)● http://www.youtube.com/Miniminter● http://www.youtube.com/MM7Games● http://www.instagram.com/Miniminter● http://www.twitter.com/MiniminterEdited by @chipfat /// https://twitter.com/CHIPFAT_,People & Blogs
uyrAtpS8uXI,The FLEXC Build Gets Bigger Than I Ever Expected 😳😳,2023-11-14T07:00:19.000Z,UCOKfn-mWuaaSPIrvztSxf1w,Built Not Bought,budget builds|explore life|red dirt diary|tj jack|collaboration|sam eyles delica|delica diesel|sam eyles budget build|sam eyles explore life|sam eyles $5000|sam built not bought|built not bought|budget builds 2022|red dirt diary budget build|tj jack mac budegt build|mac preson|tj jack jeep|bri bridget|new build|big block|sam eyles new build|xc falcon|supercharger 454 big block|NEW BUILD REVEALED!!,38758,1376,0,33,https://i.ytimg.com/vi/uyrAtpS8uXI/default.jpg,False,False,"BNB MERCH!!https://bnbmerchandise.com.au/The XC has been the biggest project I have ever undertaking. Been worked on in the background for over 2 years now, and in this Episode we get to see what it looks like for the first time with the body on the chassis!!#FLEXC #lifted #MonsterPlease SUBSCRIBE & ENJOY :)Chapters0:00 Intro0:29 New Speedwerx Bender2:24 First Bend3:49 Building Roll Cage6:52 Mounting Fuel Cell8:31 Boys Taking Over The Workshop10:15 Mounting Rear Shocks12:30 Dropping Body On ChassisFollow the Adventure on InstagramSam https://www.instagram.com/sam_eyles/Monique https://www.instagram.com/bnb_monique/Mitch https://www.instagram.com/bnb_mitch/Our Mission!“Built Not Bought is a multi-disciplined automotive and outdoor entertainment outlet. We live by the term “EDU-TAINMENT” a cross between education and entertainment. A one-stop-shop for all DIYers to learn, engage and be inspired by our brand.",Autos & Vehicles
