video_id,title,published_at,channel_id,channel_title,tags,view_count,likes,dislikes,comment_count,thumbnail_link,comments_disabled,ratings_disabled,description,category_name
SVgVzEVeP4Q,How Elon Musk’s Starlink Is Bringing In Billions For SpaceX,2023-11-11T17:00:25.000Z,UCvJJ_dzjViJCoLf5uKUTwoA,CNBC,CNBC|business news|finance stock|stock market|news channel|news station|breaking news|us news|world news|cable|cable news|finance news|money|money tips|financial news|Stock market news|stocks|spacex|spaceX Launch|spacex news|elon musk twitter|elon musk net worth|elon musk on tesla|elon musk on space|elon musk grimes|elon musk wife|elon musk meme|elon musk interview|starlink|spacex satallite internet|spacex rocket|spacex mars|starlink internet,2733732,21941,0,3570,https://i.ytimg.com/vi/SVgVzEVeP4Q/default.jpg,False,False,"Starlink is SpaceX’s answer to providing global, high-speed internet coverage using a network of thousands of satellites buzzing around the planet in a region known as low Earth orbit (LEO), about 342 miles above the Earth’s surface. SpaceX launched its first batch of Starlink satellites back in 2019, and since then, adoption of the service has ballooned. Starlink now has over 2 million active customers and is available on all 7 continents and in over 60 countries. Starlink has been praised for its ability to connect remote parts of the world that would otherwise not have access to reliable internet. The service has also become indispensable in areas hit by natural disasters, and, more recently, during times of war, particularly the Russia-Ukraine war. But Starlink’s growing influence is garnering condemnation from some who say that SpaceX CEO, Elon Musk is meddling in geopolitics, while the scientific community is raising alarms of the effect of thousands of satellites on radio and optical astronomy.Chapters:00:00 - 03:03 Intro03:03 - 06:36 Behind Starlink’s growth06:36 - 10:33 Starlink and geopolitics10:33 - 15:35 Scientific concerns15:35 - 18:38 FutureProduced and Edited by: Magdalena PetrovaAnimation: Mallory BranganSupervising Producer: Jeniece PettittEditorial Support: Michael SheetzAdditional Footage: Getty Images» Subscribe to CNBC: https://cnb.cx/SubscribeCNBC» Subscribe to CNBC TV: https://cnb.cx/SubscribeCNBCtelevisionAbout CNBC: From 'Wall Street' to 'Main Street' to award winning original documentaries and Reality TV series, CNBC has you covered. Experience special sneak peeks of your favorite shows, exclusive video and more.Connect with CNBC News OnlineGet the latest news: https://www.cnbc.com/Follow CNBC on LinkedIn: https://cnb.cx/LinkedInCNBCFollow CNBC News on Facebook: https://cnb.cx/LikeCNBCFollow CNBC News on Twitter: https://cnb.cx/FollowCNBCFollow CNBC News on Instagram: https://cnb.cx/InstagramCNBC#CNBCHow Elon Musk’s Starlink Is Bringing In Billions For SpaceX",News & Politics
D7aWd-XJSwU,Digging a SECRET GARAGE Part 1,2023-11-09T16:00:07.000Z,UCp68_FLety0O-n9QU6phsgw,colinfurze,[none],6576244,232977,0,9970,https://i.ytimg.com/vi/D7aWd-XJSwU/default.jpg,False,False,"Get an exclusive Surfshark Black Friday deal! Enter promo code COLIN to get up to 6 additional months for free at https://surfshark.deals/colinCheck out the 2nd channel here https://www.youtube.com/@2MuchColinFurzeTHE BUILD IS ON........This is one huge project, subscribe as who knows whats going to happen.Update 3 on the 2nd channel https://youtu.be/hDh403s8PnY?si=VZlD4H2KMRKhAljqToms Channel https://www.youtube.com/@Tomlamb980Get Furze Merch https://www.colinfurzeshop.comFollow me on Social Media.Instagram https://www.instagram.com/realcolinfurze/Twitter https://twitter.com/colin_furzeFacebook https://www.facebook.com/Colin-furze-521680751253584TikTok https://vm.tiktok.com/JJ8wSTs/MusicTrack 1 is called Modern Man by Virgin Mary Discohttps://linktr.ee/virginmarydisco?mibextid=Zxz2cZTrack 2 is Thing will never be the Same by Droids Osakahttps://open.spotify.com/track/4aHQnYdXncxQTM41DtIBVc?si=az3vVUKDSdKWb0i7Zx9XVghttps://droidsosaka.bandcamp.comhttps://www.instagram.com/droidsosaka/Track 3 is Dolce and Gabbana by Galivanteshttps://open.spotify.com/artist/1jLJGaMOZ68r0pPyTUoBSvTrack 4 is Dish Pig by Ghost Bumps https://ghostbumps.bandcamp.com/Track 5 is Charity for Nothing by Heroichttp://open.spotify.com/track/3tI0c34...Track 6 is called Loud Shirts by Chay SnowdonWebsite: https://chaysnowdon.co.uk/Instagram: https://www.instagram.com/chaysnowdon/?hl=enFacebook: https://en-gb.facebook.com/chaysnowdonmusic/Track 7 is Denihilism by Subtasticshttps://www.facebook.com/subtasticshttps://subtastics.bandcamp.comhttps://twitter.com/subtasticshttps://www.instagram.com/subtasticsAND LAST Track the awesome VILVALDI-Winter by Look Mum No Computerhttps://youtu.be/Z1-Gupagw9U?si=8cLk6xOmgY_1E9wvIn a band, want your music on my videos! Send your tracks to furzemail@yahoo.co.uk as all music on this channel is from viewer's.#colinfurze #tunnel #secretgarage #underground",Entertainment
1SubQuNFwD8,Preparing To Be A Family Of 4,2023-11-12T17:12:30.000Z,UCnEn0EUV13IR-_TK7fiIp3g,Alfie Deyes Vlogs,daily|vlog|zoe|sugg|nala|cute|couple|zalfie|baby|pregnant|pregnancy|girl|daughter|house|garden|summer|alfie|deyes|dad|preparing|new baby|double|unboxing|bedrooms|tour,388472,17029,0,412,https://i.ytimg.com/vi/1SubQuNFwD8/default.jpg,False,False,► Preparing To Be A Family Of 4• http://www.FutureSelfShop.com• http://www.FutureSelfCoffee.com----------------------------------------­­­­­­­----------------------------------­-­-­-­My Instagram • https://instagram.com/AlfieDeyes----------------------------------------­­­­­­­----------------------------------­-­-­-­-• Music •Epidemic Sound http://www.davidcuttermusic.com@dcuttermusic----------------------------------------­­­­­­­----------------------------------­-­-­-­-• Contact • Enquiries@AlfieDeyes.com----------------------------------------­­­­­­­----------------------------------­-­-­-­-­-,People & Blogs
VjwCYgxVGRU,What you don't see with my life Off-Grid,2023-11-12T14:00:11.000Z,UCsphzld6v6ghCl_RyvihNgA,Max & Occy,[none],174571,17109,0,993,https://i.ytimg.com/vi/VjwCYgxVGRU/default.jpg,False,False,"It's time to show you what happens outside the normal videos. Click my CoPilot link https://go.mycopilot.com/MaxandOccy to get 14 days free with your own personal trainer!In this video I show you some of the behind the scenes jobs that are always happening in the background as I continue to build my dream life off grid in Australia.Subscribe to the channel (it's free!): https://www.youtube.com/@MaxandOccyVisit our NEW WEBSITE - https://maxandoccy.com/For the behind the scenes - Join us on Instagram https://www.instagram.com/max.bidstrup/Business Enquiries - maxbid88@gmail.comJoin my crew by supporting me on Patreon : )https://www.patreon.com/maxandoccyOr, for one time donations PayPal to maxbid88@gmail.com   Thank you!!! Music - all music I use in my videos can be found on a playlist here! https://open.spotify.com/playlist/26Z0mBvFsqwk2kdUQ6HUOm?si=b2c9e20935a34734After 6 years of full time van life and travel I have bought my dream land and plan to create an off-grid homestead! Occy and I would love for you to join us on this journey and learn with us along the way!WHERE DO I GET MY MUSIC??http://share.mscbd.fm/maxandlee ⬅️Elevate your videos with record-label quality music from Musicbed!",People & Blogs
RLgXk2xy79c,Indie World Showcase 11.14.2023 - Nintendo Switch,2023-11-14T17:25:51.000Z,UCGIY_O-8vW4rfX98KlMkvRg,Nintendo of America,nintendo|game|gameplay|fun|video game|action|adventure|play|switch|nintendo switch,726308,21362,0,1367,https://i.ytimg.com/vi/RLgXk2xy79c/default.jpg,False,False,Check out a selection of indie games from around the world coming to Nintendo Switch in the latest Indie World Showcase!Follow Indie World on Twitter: https://twitter.com/IndieWorldNAVisit Nintendo.com to find more indie games: https://www.nintendo.com/us/indie-world00:00 – Indie World Showcase Intro00:29 – Shantae Advance: Risky Revolution02:37 – Core Keeper04:13 – On Your Tail06:35 – Howl08:14 – The Star Named EOS10:20 – Backpack Hero11:24 – Blade Chimera12:16 – A Highland Song14:32 – Moonstone Island15:28 – Death Trick: Double Blind17:54 – Outer Wilds: Archaeologist Edition19:48 – Planet of Lana19:59 – Enjoy the Diner20:09 – Heavenly Bodies20:22 – The Gecko Gods20:33 – Passpartout 2: The Lost Artist20:45 – Urban Myth Dissolution Center20:57 – Braid: Anniversary Edition21:10 – Indie World Showcase Outro#IndieWorld #NintendoSwitchSubscribe for more Nintendo fun! https://goo.gl/HYYsotVisit Nintendo.com for all the latest! http://www.nintendo.com/Like Nintendo on Facebook: http://www.facebook.com/NintendoFollow us on Twitter: http://twitter.com/NintendoAmericaFollow us on Instagram: http://instagram.com/NintendoAmericaFollow us on Pinterest: http://pinterest.com/Nintendo,Gaming
48ByTpm-9u4,WHAT BROKE? Patrol VS Landcruiser in TALLAROOK,2023-11-11T22:00:03.000Z,UCY8J6H75KVsPg72WlLfU5Ig,Aussie Arvos,TD42|Nissan|Patrol|Ute|GQ|4x4|4wd|price|cost|turbo diesel|Toyota|landcruiser|diesel|stock|gq patrol|aussie arvos|79 series|80 series|75 series|Aussie Arvos|4wd action|Maintenance|4wd 24/7|mud|offroad|offroad tracks|dirt|4wding|camping|duelcab|pickup|truck|Hilux|V8|LIFT|12 volt|High Country|Draws|traveling|vanlife|explore|Catch Can|EGR|Coil Swap|rebuild|suspension|coils|restoration|tyres|fabrication|auto|winch|highmount|tallarook|tracks|VIC|rock|hill climb|bush,56960,2810,0,156,https://i.ytimg.com/vi/48ByTpm-9u4/default.jpg,False,False,"Today on Aussie Arvos we are back out on the tracks for some 4WDing! We head to the nitorious 4x4 Playground of Tallarook and explore what it has to offer. Spectacular camping, Hard tracks, this is a trip worth taking! AUSSIE ARVOS T-SHIRTS AVAILABLE NOW! http://aussiearvos.com.au/Buy an Aussie Arovos sticker for your RigAussie Arvos STICKERS: ➡️ https://aussiearvos.com.auFOLLOW US ON INSTAGRAM @AUSSIEARVOSFollow Aussie Arvos @ https://www.instagram.com/aussiearvos/Follow Patrick @ https://www.instagram.com/thepatrickj/Follow Liam @ https://www.instagram.com/_liam.jones_/#4x4 #Camping #offroad MUSIC CREDIT------------------------------------Music by Scott Buckley - released under CC-BY 4.0. www.scottbuckley.com.auSanctuary by Scott Buckley - released under CC-BY 4.0. www.scottbuckley.com.auTitan by Scott Buckley - released under CC-BY 4.0. www.scottbuckley.com.auFreedom by Scott Buckley - released under CC-BY 4.0. www.scottbuckley.com.auPassage of Time by Scott Buckley - released under CC-BY 4.0. www.scottbuckley.com.auBalefire by Scott Buckley - released under CC-BY 4.0. www.scottbuckley.com.auTerminus by Scott Buckley - released under CC-BY 4.0. www.scottbuckley.com.auMusic from #InAudio: https://inaudio.org/ Track Name.Infraction- The HeatInfraction- MotorInfraction- ill The PanicInfraction- Dark WaterInfraction- SynergyInfraction- BackfireInfraction- PunchInfraction- Gym ClassInfraction- TelevisionInfraction- Getting HotInfraction- New EraInfraction- DiabolusInfraction- StrongInfraction- StylishInfraction- My BikeInfraction- Sport RockInfraction- DiscoveryInfraction- Waiting For The StormHip Hop Christmas – Twin MusicomDrive by MOKKAUnderground by MOKKAMusic provided by MokkaMusic channel and https://inaudio.org",Autos & Vehicles
hPwnRJL6SEY,PlayStation Portal Review: Everything you NEED to know,2023-11-13T14:05:19.000Z,UC0oI44ZUVCqq4meNOOaKPTQ,SpawnPoiint,playstation portal|playstation 5|ps portal|project q|handheld gaming|playstation portal release date|remote play|playstation portal review|playstation portal hands on|playstation portal remote|playstation portal remote player|playstation portal unboxing|playstation portal screen|playstation portal price|ps5|ps5 portal|best handheld console|new ps5|spawnpoiint,797368,16686,0,3710,https://i.ytimg.com/vi/hPwnRJL6SEY/default.jpg,False,False,"Review and unboxing of the NEW PlayStation Portal, a handheld gaming device that lets you play your PS4 and PS5 games on the move. We’ll look at the design, portability, gaming features, remote play and how it works away from home. AD PlayStation Portal gifted by PlayStation.PlayStation Portal available here - https://direct.playstation.com/en-us/buy-accessories/playstation-portal-remote-player?utm_source=youtube&utm_medium=spawnpoiint&utm_campaign=spawnpoiintPS5 vs Xbox Series X - Which is best? https://www.youtube.com/watch?v=b0zE0jrAUXoThanks for watching, Chris.Sign up to my newsletter - https://spawnpoiint.substack.com/Wallpapers - https://gumroad.com/spawnpoiintFull Gear List - https://kit.co/spawnpoiintMusic from Epidemic - http://share.epidemicsound.com/spawnpoiintInstagram - https://instagram.com/spawnpoiintTwitter - https://twitter.com/spawnpoiintTikTok - https://www.tiktok.com/@spawnpoiiintWebsite - https://www.spawnpoiint.comNOTE: I may earn a commission from some of the links (thank you for supporting me).-----------------------------------------------------------0:00 | Intro0:27 | Unboxing0:53 | Design and Controls2:35 | Setting it up3:26 | Screen4:19 | Gaming7:16 | Comfort7:47 | Input delay8:38 | Away from home?9:42 | Switching it on/off10:19 | Fans and Heat10:35 | Movie streaming11:00 | Battery11:29 | User interface12:25 | Speakers13:16 | Compared to the others14:07 | Worth buying?-------------------------------------------------------------#PlayStation #PlayStationPortal #PS5 #Portal #Unboxing #Review #Gaming",Science & Technology
yLa7j3MMLhA,LOKI 2x06 BREAKDOWN! Easter Eggs & Details You Missed!,2023-11-11T00:28:00.000Z,UC7yRILFFJ2QZCykymr8LPwA,New Rockstars,new rockstars|new rockstars youtube|youtube new rockstars|Loki|loki 2x06|loki 206|loki glorious purpose|loki finale|loki finale breakdown|loki breakdown|loki easter egg|loki ending explained|erik voss|new rockstars loki|erik voss loki,1813959,77743,0,3791,https://i.ytimg.com/vi/yLa7j3MMLhA/default.jpg,False,False,"New Dr. Squatch customers will receive 3 FREE SOAPS when you purchase the Buy3Get3 bundle by clicking the link: https://drsquatch.com/newrockstarsSponsored by Dr.Squatch! Loki Finale Breakdown! Season 2 Episode 6 “Glorious Purpose” frame-by-frame analysis by Erik Voss! The Loki 2x06 Season 2 Finale was one of the finest hours of storytelling in MCU history, bringing Loki full circle with He Who Remains and closing the book on Mobius, Sylvie, and the TVA. Erik Voss analyzes the deeper themes of this finale episode and breaks down all the details you might have missed!Get tickets to our upcoming live event in Los Angeles on November 16th - https://shorturl.at/mwMVYCheck out our sweet, sweet merch! http://www.NerdRiot.shopCHAPTERS00:00 - Glorious Purpose01:03 - Music Easter Eggs04:45 - Victor Dies Over and Over07:00 - Centuries Later09:40 - Divide by Zero10:45 - Back to the Citadel15:40 - We Die with the Dying17:45 - Loki vs He Who Remains20:24 - Doctor Doom Easter Egg?22:10 - Alternate Episode 5?23:55 - Loki Sacrifice25:19 - Yggdrasil28:55 - New TVA29:48 - Quantumania Kang Clue32:00 - Renslayer in Void33:14 - Loki Final SceneSubscribe | Enable ALL push notifications 🔔New Rockstars: https://newrockstars.link/NR-SubThe Deep Dive: https://newrockstars.link/DD-SubThe Breakroom: https://newrockstars.link/BR-SubFollow New Rockstars​:Instagram: ​https://instagram.com/newrockstarsFacebook: ​https://facebook.com/newmediarockstarsTwitter: ​https://twitter.com/newrockstarsPatreon: ​http://patreon.com/newrockstarsAbout New Rockstars:Hey everyone, welcome to the official New Rockstars YouTube channel! We got you covered with our in-depth analysis of every movie and television show you love! Don’t forget to subscribe and enable all push notifications so you never miss a podcast, breakdown, or theory.PATREON PRODUCERS:Comically Inclined StudiosLadmiaLookNoHandsKaren WangRick DenmonRXJediWritten by: Erik VossResearch by: Noah ChenExecutive Producer: Erik Voss http://www.twitter.com/eavossGeneral Manager: Zach HuddlestonDirector of Programming: Brandon BarrickHead of Production: John CostaPost Production Supervisor: Riley AuskelisStaff Editors: Drew Coombs, Joshua Steven HurdEditors: alexa, Ed Vilderman, Georden West, Kelly Joule, Cody KennerCamera Operator: Dashiell HamingsonFor business inquiries please contact business@nrdigitalstudios.com",Entertainment
Glp1CteDkN4,THE ULTIMATE ROADTRIP! 2000KMS IN A WEEK!,2023-11-12T06:00:09.000Z,UCU7WCO2ymb8HSfee1z72X-w,The Explore Life,4x4|4WD USA|Ram 4x4|overland|overland Ram|san francisco|big sur|yosemite national park|redwoods national park|4wd247|all4adventure|ram 2500|roadtrip|van life,67451,1988,0,103,https://i.ytimg.com/vi/Glp1CteDkN4/default.jpg,False,False,"WANT TO WIN OUR RETRO HILUX BUILD?? GET YOUR EXPLORE GEAR HERE! 👇https://theexplorelife.com.au Welcome back to another episode! This week we're back on the road in the USA heading from Texas back up to meet with Dean and the family! We pass through some epic tourist destinations on our way to Oregon! San Fransico, The Big Sur, Yosemite National Park & The Redwoods! WOULD YOU DO THIS ROADTRIP? LET US KNOW BELOW!FOLLOW OUR DAY TO DAY ADVENTURES @thexplorelife@matts_explorelife#theexplorelife #roadtrip #yosemite",People & Blogs
pwOj_bb5wKU,Beating Fresh's Record 4 Years Later...,2023-11-10T08:25:08.000Z,UCh7EqOZt7EvO2osuKbIlpGg,Lachlan,fortnite battle royale|fortnite|lachlan|lachy|duos|new season|battle royal|lacy|laclan|epic games|gaming|esports|games|video games|poggies|battle royale|warzone|pubg|lachydachy|power|pwr|rocketleague|rlcs|fortniteupdate|update|battlepass|battle|pass|fresh|mrfreshasian|alexfn|pwr alex|fortnite competitive|competitive|OG|OG Fortnite|Chapter 1|Season 5|Season 6|Chapter 4,1395468,29913,0,403,https://i.ytimg.com/vi/pwOj_bb5wKU/default.jpg,False,False,"EPIC Games gave me MY OWN TOURNAMENT & Today my goal is to beat the Competitive Record I had with Fresh!Use Code LachyMy Cracked Duo: @alexfn7806 Join PWR Discord: https://discord.gg/pwrSubscribe to Lachy Shorts! http://bit.ly/LachyShortsSubscribeMy preferred preipherals, Nacon | RIG: https://riggaming.com/pwr⚡️My APPAREL⚡️ | https://PWR.Supply❱ Subscribe to PWR ⚡️🎮 | https://bit.ly/PWRsubscribe❱ Subscribe to Shorts | http://bit.ly/LachyShortsSubscribe❱ Subscribe to Lachlan | https://bit.ly/LachlanSubscribe❱ Subscribe to 2nd Channel | https://bit.ly/LachlanPlayzSubscribeFollow me on:❱ Twitter | https://twitter.com/LachlanYT❱ Instagram | http://instagram.com/Lachlan❱ TikTok | http://TikTok.com/@lachlanPWR:❱ Twitter | https://twitter.com/TeamPWR❱ Instagram | https://instagram.com/TeamPWR❱ TikTok | https://www.tiktok.com/@PWR❱ Twitch | https://twitch.tv/TeamPWRgg❱ Facebook | https://facebook.com/TeamPWRgg❱ Website | https://teampwr.ggMusic supplied by: ❱ Epidemic Sounds | http://bit.ly/EpidemicSoundsLachy❱ MonsterCatMedia |    / monstercatmedia  ❱ Incompetech | http://www.incompetech.com/Musicbed SyncID:MB01LUI0YCY1IWCMB01EIT3AHVQ45DJoin PWR Discord: https://discord.gg/pwrSubscribe to Lachy Shorts! http://bit.ly/LachyShortsSubscribe⚡️My APPAREL⚡️ | https://PWR.Supply❱ Subscribe to PWR ⚡️🎮 | https://bit.ly/PWRsubscribe❱ Subscribe to Shorts | http://bit.ly/LachyShortsSubscribe❱ Subscribe to Lachlan | https://bit.ly/LachlanSubscribe❱ Subscribe to 2nd Channel | https://bit.ly/LachlanPlayzSubscribeFollow me on:❱ Twitter | https://twitter.com/LachlanYT❱ Instagram | http://instagram.com/Lachlan❱ TikTok | http://TikTok.com/@lachlanPWR:❱ Twitter | https://twitter.com/TeamPWR❱ Instagram | https://instagram.com/TeamPWR❱ TikTok | https://www.tiktok.com/@PWR❱ Twitch | https://twitch.tv/TeamPWRgg❱ Facebook | https://facebook.com/TeamPWRgg❱ Website | https://teampwr.ggMusic supplied by: ❱ Epidemic Sounds | http://bit.ly/EpidemicSoundsLachy❱ MonsterCatMedia | https://www.youtube.com/user/monstercatmedia❱ Incompetech | http://www.incompetech.com/Musicbed SyncID:MB01LUI0YCY1IWCMB01EIT3AHVQ45D",Gaming
1l4TzBFcGa0,Audacy Live: Jung Kook,2023-11-14T02:00:11.000Z,UC6X_tUVkx8O9UixT-B3yK5Q,Audacy Music,music|entertainment|audacy|audacy music|Jung Kook|Golden|BTS|BTS Army|Audacy Live,2071011,297725,0,11611,https://i.ytimg.com/vi/1l4TzBFcGa0/default.jpg,False,False,"Get ready to feel 'Golden'! Jung Kook is joining us for a very exciting Audacy Live to celebrate his new album 💜✨ Your new audio home for all the music, news, sports, and podcasts that matter to you. Live and on-demand. It’s all here. Subscribe to our Audacy News channel HERE: https://www.youtube.com/c/audacymusicLike Audacy on Facebook HERE: https://www.facebook.com/audacyaudio/Follow Audacy on Twitter HERE: https://twitter.com/AudacyFollow Audacy on Instagram HERE: https://www.instagram.com/audacyaudio/Download the Audacy App today! ➡️ https://go.audacy.com/download-applehttps://go.audacy.com/download-android",Entertainment
uD4e32ECuPY,We rated every Fried Chicken in Korea.,2023-11-15T11:34:11.000Z,UCg-p3lQIqmhh7gHpyaOmOiQ,영국남자 Korean Englishman,Korean|영국남자|영국|조쉬|올리|Josh|Ollie|KoreanEnglish|English|Man|englishman|food|음식|외국인|반응|영상|웃긴|남자|외국|도전|매운|조니|조엘|신부님|크리스|올리아빠|해물|치킨|삼겹살|korean|BBQ|fried|chicken|라면|불닭볶음면|미친남자,905890,40087,0,1994,https://i.ytimg.com/vi/uD4e32ECuPY/default.jpg,False,False,"Today we try all the delivery chicken available and decide which chicken is the best Korean chicken! We started out by thinking we’d try about 5 franchise chicken places but ended up trying 10+ chickens in the end. Which one was our favourite? I guess you’ll have to watch the video to find out!Thank you to The Kia EV9 for sponsoring this series!--한국에서 가장 맛있는 치킨 프랜차이즈는 어디일까요? 모두 각자 다 다른 브랜드를 생각하고 있지 않을까 싶은데요, 오늘은 이태리셰프 미스터 Z와 함께 영국남자피셜 베스트 배달치킨을 꼽아봅니다! 원래는 가장 유명한 프랜차이즈 5군데 정도를 비교하려고 했는데, 5군데가 10군데가 되고, 나중에는 몇가지를 먹어본지도 모르겠어요. 어쨌든 다 먹어보고 고른 저희의 PICK은? 영상에서 확인해주세요!이 시리즈 제작에 도움을 주신 The Kia EV9께 감사의 말씀을 전합니다!",Comedy
AzNua65PJPw,First groom in 10 years! Most INCREDIBLE transformation EVER! | King Shepherd,2023-11-11T15:00:12.000Z,UC94iuT0ABFJYZD1L20wvY7w,Girl With The Dogs 2,[none],3696719,133168,0,7977,https://i.ytimg.com/vi/AzNua65PJPw/default.jpg,False,False,"Clean-up video: https://youtu.be/7zZ52SJb7hw?si=EoBcXZcV1mgXOTc1*NASTY CRITTER! EVERYDAY DEEP CLEANING SHAMPOO BY GIRL WITH THE DOGS*https://girlwiththedogs.com/shop/p/girl-with-the-dogs-nasty-critter-everyday-deep-cleaning-pet-shampoo-16oz*FLUFF OFF! GWTD DE-SHEDDING PRODUCT LINE*https://girlwiththedogs.com/shop*ALSO AVAILABLE ON AMAZON, LINK BELOW**CORAL SLICKER BRUSH* https://girlwiththedogs.com*EQUIGROOMER™ DE-SHEDDING BRUSH:* https://girlwiththedogs.com/shop*PET BANDANAS* https://girlwiththedogs.com/shop*HAPPY HOODIE®:* https://girlwiththedogs.com/shop?tag=Pet%20Products*NEW! High quality leather alternative leashes:* https://www.girlwiththedogs.com*Fluff Off De-shedding shampoo:* https://www.amazon.com/Girl-Dogs-Natural-Deshedding-Oz/dp/B0BG7H8P84?maas=maas_adg_4F0D549612B89E1E7FB1C8121414BC8A_afap_abs&ref_=aa_maas&tag=maas*Fluff Off De-shedding conditioner:* https://www.amazon.com/Girl-Dogs-Natural-Deshedding-Conditioner/dp/B0BG7N84GT?maas=maas_adg_CABD14289C3401B69C5B099AC0EB2FB9_afap_abs&ref_=aa_maas&tag=maas*Blueberry Bubble Gum Pet Cologne:* https://www.amazon.com/Girl-Dogs-Fluff-Blueberry-Bubblegum/dp/B0BLC21QSX?maas=maas_adg_50330CEEAE3F55EC227D48DE9E559606_afap_abs&ref_=aa_maas&tag=maas*HAPPY HOODIE AMAZON CANADA*https://www.amazon.ca/Zoni-Pets-LLC-Happy-Hoodies/dp/B08N1LFBV3/ref=mp_s_a_1_3?crid=3M1EJ4KCK9PP6&keywords=happy+hoodie+for+dogs&qid=1649500731&sprefix=happy+ho%2Caps%2C101&sr=8-3*SHAMPOO NOZZLE:* https://www.amazon.com/shop/perfectpoochesgrooming/list/3S8IHIPUFW3C6*FACEBOOK:*https://www.facebook.com/perfectpoochesgrooming*INSTAGRAM:*https://www.instagram.com/perfectpoochesgrooming/*Breed specific product recommendations:**USA:* https://www.amazon.com/shop/perfectpoochesgrooming*CANADA:* https://www.amazon.ca/shop/perfectpoochesgrooming*Disclaimer: I am an Amazon associate and I earn commissions from my Amazon storefront**PAYPAL*https://paypal.me/girlwithedogs",People & Blogs
