video_id,title,published_at,channel_id,channel_title,tags,view_count,likes,dislikes,comment_count,thumbnail_link,comments_disabled,ratings_disabled,description,category_name
e8WUTXH0Mcs,New Project Car + BIG NEWS!,2023-11-15T06:24:09.000Z,UCFUBt5_cGJpt58XBIh4RtNA,The Skid Factory,woody|al|turbo|yoda|tsf|the|skid|factory|Mighty|Car|Mods|Bennys|Custom|Works|Freedom|ECU|Tool|Pro|haltech|GFB,110180,8438,0,1165,https://i.ytimg.com/vi/e8WUTXH0Mcs/default.jpg,False,False,"Woody bought this Neat VG30 Twin Turbo Z32 300zx in November 2018 as a surprise for Al. With a Melted VG30DETT and clean paint this was a perfect donor for a stupid engine conversion. Originally Al went down the path of bolting on a pair of G25-900's to a Nissan VH41DE 4.1L Alloy V8 but as the months went past lost interest in the project due to the complexity of the build. A few engine conversion ideas were floated around including a DCT backed Honda K24, Turbo VW VR6 or even just a stout VG30 but in the end Alan landed on the path of building a RB25/30.With the help from some epic companies like@haltechHaltech, Go Fast Bits, Raceworks, Golebys Parts and Supercheap Auto this vision is coming to life and AL's Dream 300ZX will soon be a reality! Supercheap Auto: https://www.supercheapauto.com.auRaceworks: https://raceworks.com.au Haltech: https://www.haltech.com Go Fast Bits: https://gfb.com.auGolebys Parts: https://golebysparts.auKelford Cams: https://kelfordcams.comRoss Performance Parts: https://rossperformanceparts.comA like & A Share goes a long way! If you like the show then your friends will too!Still reading? You must be a Legend, Buy yourself a new shirt! https://www.theskidfactory.comWrite your name in the Credits! http://www.patreon.com/theskidfactoryFollow The Skid Factory for more content:https://www.instagram.com/woodrigos/?hl=enhttps://www.instagram.com/theskidfactory/?hl=enhttps://www.facebook.com/TheSkidFactory/https://www.instagram.com/turboyodatsf/?hl=enhttps://www.facebook.com/theturboyoda/https://www.tiktok.com/@theskidfactoryPlease note: We're just a couple of Mates hanging out in the shed, There's no big production companies, fancy cameras or Scripts, We love what we do and try our best to create quality content for you to enjoy every week. Sometimes that includes a steering rack conversion, Other times it's as simple as bolting on some wheels to our daily drivers. Don't forget that working on cars isn't easy and can be dangerous. Use Ya Brain and take the necessary safety precautions whenever you're modifying your car. Consume Lemon Squash responsibly & Thanks for watching. #THESKIDFACTORY #SKIDFACTORY #TURBO",Autos & Vehicles
CFpTzgk5jk0,Why Shouldn't The Universe Exist?,2023-11-16T20:48:06.000Z,UCtRFmSyL4fSLQkn-wMqlmdA,History of the Universe,[none],275133,8451,0,965,https://i.ytimg.com/vi/CFpTzgk5jk0/default.jpg,False,False,"Enjoy 10% discount and free shipping on all Hoverpens with code HOTU:North America & other countries: https://bit.ly/HOTU_noviumUK & Europe: https://bit.ly/HOTU_noviumeu--------------------------------Written by Antonio PadillaCheck out his fantastic book here: https://www.amazon.com/Fantastic-Numbers-Where-Find-Them/dp/0374600562Huge thanks to Prof. Derek Leinweber for his visualisations at http://www.physics.adelaide.edu.au/theory/staff/leinweber/VisualQCD/Nobel/Narrated by David KellyEdited by Manuel Rubio and David KellyThumbnail art by Ettore Mazza: https://www.instagram.com/ettore.mazza/?hl=enSound Editing by Craig StevensonAnimations by the superb Jero Squartini https://www.fiverr.com/share/0v7Kjv using Manim - MIT License, (c) 2020-2023 3Blue1Brown LLCGalaxies, space videos from NASA, ESA and ESO.Music from Epidemic Sound, Artlist, Silver Maple And Yehezkel Raz.Stock footage from Videoblocks, Artgrid and Shutterstock.Extra images from:https://commons.wikimedia.org/wiki/File:Geckofot.jpghttps://oac.cdlib.org/ark:/28722/bk0016t4c52/?brand=oac4https://commons.wikimedia.org/wiki/File:CERN_OpenDays_@_LHC_02.jpghttps://en.wikipedia.org/wiki/File:View_inside_detector_at_the_CMS_cavern_LHC_CERN.jpg00:00 Introduction05:38 What Is Energy?12:46 How Much Does The Universe Weigh?25:24 The Nullpunktsenergie45:06 The Cosmological Constant Problem",Education
oMFDV7NZSjk,UNHhhh ep 220 - Nightmares,2023-11-15T20:00:03.000Z,UCUUUpaMp8DV6KUOfQwoIiLg,WOWPresents,world of wonder|world of wonder productions|wow presents|wow presents plus|rupaul's drag race|drag race|rpdr|unh|unhhhh|season|eight|trixie|mattel|katya|zamo|zamolodchikova|episode|220|nightmares,489402,28148,0,1035,https://i.ytimg.com/vi/oMFDV7NZSjk/default.jpg,False,False,"Watch extended episodes 30 days earlier on WPP: https://bit.ly/3EyDiIBFive, Six, Seven, Eight, Freddy is - gonna be late. This week Trixie and Katya get into the ooky-spooky spirit by revealing their nightmares. The call is coming from inside the house.Buy UNHhhh Merch: https://store.worldofwonder.com/collections/unhhhhProduced byPete WilliamsEdited byJeff MaccubbinRon HillPaul DetrickSubscribe: http://youtube.com/subscription_center?add_user=wowpresentsWorld of Wonder (WOW) has reshaped international pop culture, earning 30 Emmys, inspiring two Oscars, creating global network WOW Presents Plus across 190 territories, and bringing drag culture to the world stage via RuPaul’s Drag Race and DragCon. WOW’s pioneering television portfolio includes other smash-hit franchises like Million Dollar Listing. Their film division WOW Docs produces groundbreaking documentaries including Mapplethorpe: Look at the Pictures, Party Monster, and The Eyes of Tammy Faye. Watch the Drag Race franchise and uncensored WOW Originals on our streaming service, WOW Presents Plus.",Entertainment
C0xqbxemWKM,The BEST Goal Ever Scored in YouTube History...,2023-11-16T17:00:09.000Z,UCi33DX7KG3M3bI0ipjOP2Eg,Ben Foster - The Cycling GK,Angry Ginge|Ben Foster|Boxing Gloves|Challenge|English premier league|GK Glove Challenge|Manchester United|Mark Goldbridge|Premier League|The Cycling GK|angry ginge compilation|angry ginge goal|angry ginge yanited|best goals|best goals in football|cgk ben foster|challenge video|football goals|football goals 2023|soccer|soccer edits|soccer games,283963,12410,0,2389,https://i.ytimg.com/vi/C0xqbxemWKM/default.jpg,False,False,"FOOTBALL CHALLENGE VIDEOS ARE BACK!!!!!Angry Ginge & Mark Goldbridge, two of United’s biggest super fans are being put to the test against a retired Premier League Goalkeeper. Although it wouldn’t be a challenge video without a TWIST… 😝The lads must get questions correct to have a shot against me. I will be handicapped though as I’ll be wearing some of the most random gloves in net!!!  The person who scores the LEAST amount of goals, will have to do a forfeit and trust me, it’s not nice… 🤣😳Thank you to our mate Dan at Ball Launcher for helping us out in this video! Check out their ball launchers below! 👇🏼https://www.ball-launcher.com/ Check out Angry Ginge’s YT Channel! 👇🏼https://www.youtube.com/@angryginge13 Check out Mark Goldbridge’s YT Channel! 👇🏼https://www.youtube.com/channel/UCMmVPVb0BwSIOWVeDwlPocQPlease, please hit that SUBSCRIBE BUTTON, let's get to that 2 million mark!Like todays music from Artlist?   SIGN UP HERE TO ACCESS THE MUSIC WE USE IN THE VIDEOS 👇🏼🎵https://artlist.io/?artlist_aid=CyclingGK_1637&utm_medium=43001dcaThe AMAZING GoPro Hero 11 I shoot the VLOGS on!  Get your GOPRO here...👇🏼📹https://prf.hn/l/ERY2Pv9✅ Facebook 👉🏼 https://www.facebook.com/BenFosterTheCyclingGK✅ Twitter 👉🏼  https://twitter.com/benfoster✅ Tik Tok 👉🏼 https://www.tiktok.com/@benfcyclinggk?lang=en✅ Ben Foster Instagram 👉🏼  https://www.instagram.com/benfosters/✅ The Cycling GK  Instagram  👉🏼  https://www.instagram.com/rhinolegs_tom/Cure Leukaemia Just Giving Link 🔗👇🏼https://justgiving.com/campaign/thecyclinggkChannel Partner Garmin 🔗👇🏼https://www.garmin.com/en-GB/",Sports
BdirO6hgdwQ,FP2 Highlights | 2023 Las Vegas Grand Prix,2023-11-17T14:00:04.000Z,UCB_qr75-ydFVKSF9Dmo6izg,FORMULA 1,F1|Formula One|Formula 1|Sports|Sport|Action|GP|Grand Prix|Auto Racing|Motor Racing,2477846,43273,0,3293,https://i.ytimg.com/vi/BdirO6hgdwQ/default.jpg,False,False,"Catch up on all the key moments from practice in Las Vegas, as we saw a 90 minute FP2 following a shortened first practice session.For more F1® videos, visit https://www.Formula1.comFollow F1®:https://www.instagram.com/F1https://www.facebook.com/Formula1/https://www.twitter.com/F1https://www.twitch.tv/formula1https://www.tiktok.com/@f1#F1 #LasVegasGP",Sports
icnU0EXOJms,[1위] 'COMEBACK' 정국 - Standing Next to You #엠카운트다운 EP.823 | Mnet 231116 방송,2023-11-16T11:37:34.000Z,UCbD8EppRX3ZwJSou-TVo90A,Mnet K-POP,JungKook|KPOP|MCD|MCOUNTDOWN|Mnet|Standing_Next_to_You|스탠딩넥스트투유|엠넷|엠카|엠카운트다운|정국|케이팝|티빙에서스트리밍,1498945,192574,0,5907,https://i.ytimg.com/vi/icnU0EXOJms/default.jpg,False,False,티빙에서 스트리밍 : https://tving.onelink.me/xHqC/30a78d6fM COUNTDOWN｜Ep.823정국 - 스탠딩 넥스트 투 유 (Jung Kook - Standing Next to You)World No.1 K-POP Chart Show M COUNTDOWNEvery Thur 6PM(KST) Mnet Live on Air매주 목요일 저녁 6시 엠넷 생방송#티빙에서스트리밍,Gaming
So8hqTBHXrc,I Fused Pokémon as Team Sky,2023-11-15T19:15:00.000Z,UCnepIUw_tvOatokJAB1yipA,MandJTV Plays,mandjtv|mandjtv pokevids|gameplay|let's play|pokemon|pokemon sword and shield|pokemon sword|pokemon shield|new pokemon|pokemon let's play|playthrough|best pokemon|all pokemon|nintendo pokemon|original pokemon|pikachu|greninja|charizard|pokemon switch|legends arceus|pokemon legends arceus|pokemon scarlet and violet|scarlet violet|gen 9|pokemon fusion|fuse pokemon|infinite fusion,574901,26308,0,2127,https://i.ytimg.com/vi/So8hqTBHXrc/default.jpg,False,False,"Pokémon Infinite Fusion, played as the leader of TEAM SKY!📽️Subscribe here! http://bit.ly/mandjtv_plays👕Merch store! https://mandjtvmerch.com/💸Patreon for exclusive videos! https://www.patreon.com/JohnMichaelandCo▶️Main Pokemon Channel! http://bit.ly/mandjtv_sub📱 TikTok! http://bit.ly/mandjtv_tiktok📸Instagram! http://bit.ly/mandjtv_insta👽Reddit! http://bit.ly/mandjtv_reddit🏪Amazon Storefront! http://bit.ly/mandjtv_shopEdited by Katie RoseMytey subscribe animation by Spoody: https://www.youtube.com/channel/UCtT-Ff9o7Ygj0dUu8wGiXcw",Gaming
7h5wCc8fBEY,Was It Good? - Mirror's Edge,2023-11-16T21:00:06.000Z,UCR9X2tT0_WVfuYO17vqstlA,Josh Strife Plays,classic gaming|retro games|older games|retro review|gaming reviews|nostalgic gaming|nostalgia games|playstation 1|playstation 2|n64|dreamcast|classic rpg,280614,14864,0,1809,https://i.ytimg.com/vi/7h5wCc8fBEY/default.jpg,False,False,"Patreon: https://www.patreon.com/joshstrifehayesTwitch: https://www.twitch.tv/joshstrifehayesDiscord: https://discord.gg/GM2sCUXTwitter: https://www.twitter.com/joshstrifehayes#####Toeknees video: https://youtu.be/cjsYS-e7iW4?si=jai26Ul9vFoD0K2C#####Get some air in your lungs and run, Faith.In 2008 DICE stepped away from the Battlefield franchise and made a game all about movement, a parkour, free running adventure game, with one of the smoothest and most satisfying movement systems the gaming world had seen.But does it still hold up today, and if you did replay it, would it actually be any good?Thank you to the Youtube, Patreon and twitch supporters who keep this channel alive. Still Alive.",Entertainment
KEFNlx4ZIOU,"Red Velvet (레드벨벳)의 킬링보이스를 라이브로!ㅣ행복 (Happiness), Chill Kill, Oh Boy, Psycho, You Better Know, Bad Boy",2023-11-14T10:00:10.000Z,UCtCiO5t2voB14CmZKTkIzPQ,딩고 뮤직 / dingo music,딩고뮤직|dingo|dingomusic|music|kpop|live|멜론|세로라이브|최신가요|top100|아이돌|라이브|음악|딩고|명곡|메들리|highlight|medley,5188825,361830,0,23663,https://i.ytimg.com/vi/KEFNlx4ZIOU/default.jpg,False,False,눈 감았다 뜨면 33분 지나있는 레전드 킬보😙0:00 시작0:40 행복 (Happiness) 2:42 Dumb Dumb 3:57 Ice Cream Cake 5:20 러시안 룰렛 (Russian Roulette) 6:34 짐살라빔 (Zimzalabim) 8:35 카풀 (Carpool)10:18 Queendom 10:54 You Better Know 12:56 빨간 맛 (Red Flavor) 15:13 피카부 (Peek-A-Boo) 16:48 Bad Boy 18:18 Psycho 19:17 7월 7일 (One Of These Nights) 20:21 Automatic 22:02 Kingdom Come 23:46 Time To Love 24:52 Oh Boy 26:24 Lady’s Room 27:51 Feel My Rhythm 29:21 Chill Kill 🆕▶딩고뮤직 (Dingo Music) : http://bit.ly/Dingo__Music▶딩고프리스타일 (Dingo Freestyle) : http://bit.ly/Dingo__Freestyle▶일소라 (일반인들의 소름돋는 라이브) : http://bit.ly/ilsoracontact : musicbiz@makeus.com#RedVelvet #레드벨벳 #킬링보이스 #killingvoice  #딩고뮤직 #DingoMusic,Music
GlM6lcFbLSg,Can’t Catch Me Now (from The Hunger Games: The Ballad of Songbirds & Snakes),2023-11-14T02:00:09.000Z,UCxE5jEls-T0QtlTHT8lI1lw,OliviaRodrigoVEVO,Olivia|Rodrigo|Can’t|Catch|Now|(from|The|Hunger|Games:|Ballad|Songbirds|Snakes)|Pop,2918055,195615,0,5775,https://i.ytimg.com/vi/GlM6lcFbLSg/default.jpg,False,False,"Listen to ‘Can’t Catch Me Now’ by Olivia Rodrigo: https://TheHungerGames.lnk.to/CantCatchMeNowShop ‘Can’t Catch Me Now’: https://TheHungerGames.lnk.to/CantCat...Follow Olivia Rodrigo: Instagram: https://www.instagram.com/oliviarodrigo/?hl=enTwitter:  https://twitter.com/oliviarodrigoFacebook: https://www.facebook.com/OliviaRodrigoOfficial/TikTok: https://www.tiktok.com/@livbedumb?lang=enDiscord: https://discord.gg/livieshqLyricsThere's blood on the side of the mountainThere's writing all over the wallShadows of us are still dancin'In every room and every hallThere's snow fallin' over the cityYou thought that it would wash awayThe bitter taste of my furyAnd all of the messes you madeYeah, you think that you got awayBut I'm in the trees, I'm in the breezeMy footsteps on the groundYou'll see my face in every placeBut you can't catch me nowThrough wading grass, the months will passYou'll feel it all aroundI'm here, I'm there, I'm evеrywhereBut you can't catch me nowNo, you can't catch mе nowBet you thought I'd never do itThought it'd go over my headI bet you figured I'd pass with the winterBe somethin' easy to forgetOh, you think I'm gone 'cause I leftBut I'm in the trees, I'm in the breezeMy footsteps on the groundYou'll see my face in every placeBut you can't catch me nowThrough wading grass, the months will passYou'll feel it all aroundI'm here, I'm there, I'm everywhereBut you can't catch me nowNo, you can't catch me nowOohOohOohOohYou can't, you can't catch me nowI'm comin' like a storm into your townYou can't, you can't catch me nowI'm higher than the hopes that you brought downYou can't, you can't catch me nowI'm comin' like a storm into your townYou can't, you can't catch me nowI'm higher than the hopes that you brought downYou can't, you can't catch me nowI'm comin' like a storm into your townYou can't, you can't catch me nowYou can't, you can't, you can'tThere's blood on the side of the mountainIt's turning a new shade of redYeah, sometimes the fire you foundedDon't burn the way you'd expectYeah, you thought that this was the end#OliviaRodrigo #HungerGamesMusic video by Olivia Rodrigo performing Can’t Catch Me Now (from The Hunger Games: The Ballad of Songbirds & Snakes). © 2023 Olivia Rodrigo, under exclusive license to Geffen Recordshttp://vevo.ly/o6Lqnz",Music
PjgJWIA46rA,The End of NFL Man | Hot Mess with Alix Earle,2023-11-16T08:00:13.000Z,UCrcY-JpjBJj4mJv_mGwZg5g,Hot Mess with Alix Earle,hot mess|hot|mess|hot mess with alix earle|hot mess podcast|hot mess alix|alix earle|podcast|alix earle podcast|alix|earle|unwell|unwell network|podcast network|call her daddy|alex cooper|miami|vlog|university of miami|alix earle youtube|pod|alix pod,354623,9581,0,554,https://i.ytimg.com/vi/PjgJWIA46rA/default.jpg,False,False,"(VIDEO PODCAST AVAILABLE ON SPOTIFY AND YOUTUBE) This week, Alix surprises NFL Man with a trip for his birthday. She reveals what has been going on the past three months since she first updated us on her situationship.The two of them jet off to a tiny island in the Bahamas where they reveal how their vacation has unfolded. Big Al & NFL Man debrief their getaway, take a trip to a private island, and show the behind the scenes of the romantic surprises that were planned.Then Alix and NFL Man sit down to discuss their relationship and address your questions. NFL Man is put to the test as he sits down solo to talk about what Alix is really like. By the end, he asks Alix the biggest question yet…Follow and connect with all things @HotMess across Instagram, TikTok, and YouTube.  STREAM HOT MESS: https://bit.ly/m/Hot-MessInstagram: http://www.instagram.com/hotmessTik Tok: http://www.tiktok.com/@hotmessAlix's IG: http://www.instagram.com/alix_earleAlix's Tik Tok: http://www.tiktok.com/@alixearleUnwell Network: http://www.iamunwell.com",People & Blogs
J8AShnvs8h0,HIGHLIGHTS: Chelsea v Manchester City | Premier League,2023-11-12T21:00:15.000Z,UC0jPwNs4B7yJySNewHan5hQ,Optus Sport,how to watch|optus sport|australia|highlights|premier|league|goal|premier league highlights|goals|soccer|football|premier league|epl|premier league fixtures|uefa|fifa|fa|pl|epl highlights|laliga|la liga|spanish league|manchester|united|luton|town|bournemouth|newcastle|chelsea|city,285153,4123,0,405,https://i.ytimg.com/vi/J8AShnvs8h0/default.jpg,False,False,"Manchester City travelled to Stamford Bridge to face Chelsea in Premier League action..The World’s Best Football is on the Optus Sport app 👉  https://sport.optus.com.au/signup==========================For the latest updates, follow us on:►TIKTOK: https://www.tiktok.com/@optussport►TWITTER: http://twitter.com/optussport►FACEBOOK: http://facebook.com/optussport ►INSTAGRAM: http://instagram.com/optussport Feel the pulse of every match of the Premier League, live and on demand with Optus Sport. Delight in the heart-stopping action of LALIGA, J. League, Barclays Women’s Super League and more, as well as the upcoming UEFA EURO 2024™ and CONMEBOL Copa America 2024™.#OptusSport #PremierLeague #CHEMCI",Sports
5DOAtZJF8HA,The Vegas Grand Prix has been a DISASTER,2023-11-17T09:29:57.000Z,UCOCD5-cs2iy6e8T0Bo-vP9w,Perspective,formula 1|las vegas|formula one|las vegas grand prix|f1 news|f1 las vegas|carlos sainz las vegas|f1 drain cover|f1 man hole|las vegas fp1|las vegas grand prix session cancelled|perspectivef1|f1 latest|f1 highlights|f1 update|f1 youtuber|f1 content creator|f1 updates|f1 drivers|grand prix|las vegas street circuit|las vegas f1|formula 1 las vegas|f1|f1 community|f1 drama|f1 dramatic moments|motor sport|auto racing|vegas f1 race|f1 2023,127522,2723,0,457,https://i.ytimg.com/vi/5DOAtZJF8HA/default.jpg,False,False,"Formula 1 got off to a bad start in Las Vegas after a drain cover/manhole damaged the Ferrari of Carlos Sainz and the Alpine of Esteban Ocon, ending the session. Excitement for the event was cut short and FP2 has been pushed back to 2AM Local Time in Las Vegas. What steps did the FIA and F1 take to get the track ready again? Enjoy!#F1 #F1LasVegas #VegasGP _____________________________________________________My Socials : Twitter -  madebypersInstagram - madebyperspective_____________________________________________________",Sports
oFUOboC4evo,DEJI Is The WORST Fortnite Player EVER! ft. Yung Filly,2023-11-15T18:30:37.000Z,UCQIdhgHHjGbkrThGV64bVzw,angryginge13,AngryGinge13|MoreGinge|Ginge|Yanited|United|Manchester|Ginger|Fortnite|OG|Win|Victory Royale|Carry|Kills|Chug Jug|Pump|Shotgun|AR|Assault Rifle|Yung Filly|Filly|Chunkz|Beta Squad|Darkest Man|Lose|Lost|Losing|Dead|Die|Dying|Down|Shield|Potion|Deji|KSI|JJ|ComedyShortsGamer,326463,9712,0,130,https://i.ytimg.com/vi/oFUOboC4evo/default.jpg,False,False,Subscribe to Deji and Filly! - @ComedyShortsGamer @YungFilly SOCIALS ↓↓↓↓↓↓↓↓↓↓↓↓↓↓↓2nd YouTube Channel: @MoreGinge 3rd YouTube Channel: @GingePlus Twitch: https://www.twitch.tv/angryginge13TikTok: https://www.tiktok.com/@angryginge13Twitter: https://twitter.com/angryginge13Instagram: https://www.instagram.com/angryginge13/#deji #fortnite #AngryGinge13,Gaming
HZJnf3UjqfA,From Scrap to Track weapon (Saving this filthy Daihatsu),2023-11-13T20:31:44.000Z,UCgJRL30YS6XFxq9Ga8W2J3A,Mighty Car Mods,mighty|car|mods|mcm|MCM|moog|marty|turbo|how|to|diy,293508,16153,0,919,https://i.ytimg.com/vi/HZJnf3UjqfA/default.jpg,False,False,"We're cooking hard with this car, and today we are putting the final pieces of the puzzle together to make this piece of junk a proper track tyrant.►MCM HATS HERE: https://mightycarmods.com/collections/clothing/products/mighty-car-mods-flexfit-hat►MORE MERCH HERE: http://www.mightycarmods.com/collections/Huge thanks to Dave for his help and Haltech for the awesome productshttps://www.haltech.com/Castrol Edgehttps://www.castrol.com/en_au/australia/home.html3D Racing Solutions for the Dash Mounthttps://3dracingsolutions.com/DNA Autosport for the alignment and setuphttps://dnaautosport.com.au/More Mighty Car Mods on other socials here:Facebook: http://www.facebook.com/mightycarmodsInstagram: http://www.instagram.com/mightycarmodsTwitter: https://twitter.com/mightycarmodsTikTok: https://www.tiktok.com/@mightycarmods#mightycarmodsSomething to note around Mighty Car Mods: we are normal guys and are not trained mechanics. We like to make interesting car mods and show you how we've gone about it, but we can't promise that anything we show you will work for your particular car, or that you won't harm yourself, someone else, your car or your warranty doing it. Please be safe, be responsible and unless you know what you're doing, do not fool around with very serious machinery just because you've seen us make it look so easy. Talk to a qualified mechanic if you are in any doubt. Some of the products featured in this video may be supplied by sponsors. For a list of our current sponsors please go to mightycarmods.com",Autos & Vehicles
28Q44Rg69qc,HIGHLIGHTS | Real Madrid vs. Chelsea -- UEFA Women's Champions League 2023-24,2023-11-15T23:01:51.000Z,UCxgii5f9u4YgXCeubCozbEA,DAZN Women's Football,Chelsea|Real Madrid|Real Madrid vs. Chelsea|champions league|dazn|football|full match|goals|highlights|recap|soccer|top 10|ucl|uefa champions league|uefa women's champions league|uwcl|women's champions|women's football|women's soccer,686468,6577,0,1469,https://i.ytimg.com/vi/28Q44Rg69qc/default.jpg,False,False,Subscribe to DAZN 👉 https://www.dazn.comSubscribe now for the home of women's football on YouTube 👉 https://bit.ly/WomensFootballOnDAZNFollow Our Social Channels 👇Instagram: https://instagram.com/daznfootballTwitter: https://twitter.com/DAZNFootballSnapchat: https://bit.ly/UWCLSnapTikTok: https://www.tiktok.com/@daznfootballSubscribe to DAZN 👉 https://www.dazn.com#DAZN #UWCL #Football #soccer00:00:00 - Players Entrance by  Chelsea Women00:00:15 - Pass by Ann-Katrin Berger00:00:25 - Short Goal by Olga Carmona00:00:27 - Goal by Olga Carmona00:01:22 - GK Save by María Isabel Rodríguez00:01:45 - Dribble by Niamh Charles00:02:15 - Goal by Niamh Charles00:03:07 - Booking by Sandie Toletti00:03:25 - Cross by Erin Cuthbert00:03:32 - Shot by Sjoeke Nüsken00:03:38 - Shot by Sam Kerr00:03:51 - Shot by Sam Kerr00:04:27 - Goal by Sam Kerr00:05:25 - Foul by Jessie Fleming00:05:59 - Goal by Olga Carmona00:06:37 - GK Save by María Isabel Rodríguez00:07:00 - Pass by Erin Cuthbert00:07:06 - Shot by Lauren James00:07:16 - Shot by Jessie Fleming00:07:49 - Offside by Niamh Charles00:08:24 - End Match by  Chelsea Women,Sports
ufn9a4EwBG4,"Multiple ejections, Klay Thompson's jersey ripped in Warriors vs. Timberwolves altercation",2023-11-15T03:37:52.000Z,UCiWLfSweyRNmLpgEHekhoAg,ESPN,[none],1310151,8064,0,5291,https://i.ytimg.com/vi/ufn9a4EwBG4/default.jpg,False,False,"Klay Thompson and Jaden McDaniels are ejected for getting into a fight on the court, and Draymond Green is ejected for putting Rudy Gobert in a headlock.✔️ Subscribe to ESPN+ http://espnplus.com/youtube✔️ Get the ESPN App: http://www.espn.com/espn/apps/espn✔️ Subscribe to ESPN on YouTube: http://es.pn/SUBSCRIBEtoYOUTUBE✔️ Subscribe to NBA on ESPN on YouTube: http://bit.ly/SUBSCRIBEtoNBAonESPN✔️ Watch ESPN on YouTube TV: http://es.pn/YouTubeTV",Sports
