video_id,title,published_at,channel_id,channel_title,tags,view_count,likes,dislikes,comment_count,thumbnail_link,comments_disabled,ratings_disabled,description,category_name
Xty2gi5cMa8,Drake - First Person Shooter ft. J. Cole,2023-11-15T20:26:07.000Z,UCQznUf1SjfDqx65hX3zRDiA,DrakeVEVO,Drake|First|Person|Shooter|OVO/Republic|Hip|Hop,7146767,536942,0,24900,https://i.ytimg.com/vi/Xty2gi5cMa8/default.jpg,False,False,"Listen to For All The Dogs Scary Hours Edition: https://drake.lnk.to/FATDSHEDirector - Gibson HazardEP/Producer - Liam AkivaEP - Christian TylerExecutive Producer /Creative Direction- Drake, qJamil Big Juice 'DavisCreative Direction - Jack Bannon & Reduciano Production Company - House of Hazard x DenimLine Producer - Cam Frengopoulos & Alex Dall’OrsoAssociate Producer - Jackie De NivervilleProduction Manager - Trevor EvoyProduction Coordinator - Amber WarusCinematographer - Bobby Shore1st AC - Dave StuartB-Unit Director - Nick DeanProduction Designer - Electa PoradoGaffer - Jordan HeguyKey Grip - Todd N ThompsonEditors - Gibson Hazard & Jack BannonSound Design - Chris Smith & Jack Bannon3D Animation Lead - ReducianoVFX - Mathematic VFX - Karen ArakelianVFX - PendulumVFX - Scissor FilmsVFX - Black HatVFX - Aid6n.editsColourist - Dante PasquinelliGraphic Design - Alessandro ComottiSpecial thanks to Scotiabank Arena, House of Hazard, OVO, Dreamville and Vanessa Hoffer",Music
M49i6CFPMmk,How Many Trampolines Stop A 540mph Bowling Ball? (feat. @theslowmoguys),2023-11-16T22:00:08.000Z,UC5f5IV0Bf79YLp_p9nfInRA,How Ridiculous,how ridiculous|rexy|44club,1375796,53658,0,2237,https://i.ytimg.com/vi/M49i6CFPMmk/default.jpg,False,False,"Watch @theslowmoguys video: https://www.youtube.com/watch?v=KKjIqCVFUyMA HUGE thanks to Craig Beals from @BealsScience and Shaun for hosting us and building the insane bowling ball jeep cannon. More videos with it coming soon!Thanks to IGNITE Firing Systems for providing the i18 Firing Module for the bowling ball cannon. As you can see this was way better than using a normal fuse! https://www.youtube.com/@ignitefiringsystemsBuy Rexy Clothing ➤ https://rexyclothing.comBusiness Inquiries ➤ howridiculous@delkatalents.comMemberships ➤  Get bonus YouTube videos, Q&A livestreams, merch discount codes + more! http://bit.ly/HRmembershipsFollow us:Instagram ➤ https://www.instagram.com/howridiculousFacebook ➤ https://www.facebook.com/howridiculousTikTok     ➤ https://www.TikTok.com/@howridiculousTwitter     ➤ https://www.twitter.com/howridiculousDiscord   ➤ https://discord.gg/MWmqCEvjeJMusic used with permission and licensed to How Ridiculous by Dream Records LLC | Sync RoyaltyWe are passionate about seeing children released from poverty and we would love you to consider sponsoring a child with Compassion: http://cmpsn.co/howridiculous",Sports
jsI3mgcLJZA,The 72nd MISS UNIVERSE National Costume Show,2023-11-17T03:47:01.000Z,UCTdxW3Si8aduSuZbzyR2jlw,Miss Universe,miss universe|Pageants|Pageant Tutorials|Beauty Pageants|Miss Universe Full Show|missuniverso|miss universe 2022|miss universo|makeup|makeup tutorial|makeup glam,6934334,95467,0,10124,https://i.ytimg.com/vi/jsI3mgcLJZA/default.jpg,False,False,"Available for all, the 72nd MISS UNIVERSE National Costume Show! Streamed LIVE from beautiful El Salvador, watch as 84 incredible delegates take the stage in this celebration of culture and creativity. Learn more about the competition at http://www.missuniverse.comCheck out the Miss Universe Shop: https://shop.missuniverse.comStay Connected!Facebook: https://www.facebook.com/MissUniverseTwitter: https://www.twitter.com/MissUniverseInstagram: https://www.instagram.com/MissUniverse",Entertainment
s_76M4c4LTo,MADAME WEB – Official Trailer (HD),2023-11-15T14:13:00.000Z,UCz97F7dMxBNOfGYu3rx8aCw,Sony Pictures Entertainment,[none],13895871,84248,0,17810,https://i.ytimg.com/vi/s_76M4c4LTo/default.jpg,False,False,"Her web connects them all. 🕸 #MadameWeb is coming soon exclusively to movie theaters.Visit our site: https://www.madameweb.movie/Follow Us on Social:https://www.facebook.com/madamewebhttps://www.instagram.com/madamewebhttps://twitter.com/madamewebhttps://www.tiktok.com/@madamewebmovieMeanwhile, in another universe…” In a switch from the typical genre, Madame Web tells the standalone origin story of one of Marvel publishing's most enigmatic heroines. The suspense-driven thriller stars Dakota Johnson as Cassandra Webb, a paramedic in Manhattan who may have clairvoyant abilities. Forced to confront revelations about her past, she forges a relationship with three young women destined for powerful futures...if they can all survive a deadly present. Directed by:SJ Clarkson Screenplay by:Claire Parker & SJ ClarksonStory by:Kerem SangaBased on the Marvel ComicsProduced by:Lorenzo di BonaventuraExecutive Producers:Adam MerimsClaire Parker Cast:Dakota JohnsonSydney SweeneyCeleste O’ConnorIsabela MercedTahar RahimMike EppsEmma RobertsAdam Scott#MadameWeb #DakotaJohnson #SydneySweeney #CelesteOConnor #IsabelaMerced #TaharRahim #MikeEpps #EmmaRoberts #AdamScott #Sony #SonyPictures #movie #trailer #officialtrailer #Marvel #MarvelComics",Entertainment
RfLtAdSgWPQ,The Fourteenth Doctor is Here! | BBC Children in Need 2023 | Doctor Who,2023-11-17T20:16:34.000Z,UCcOkA2Xmk1valTOWSyKyp4g,Doctor Who,doctor who|the doctor|dr who|bbc|doctor who bbc|children in need|bbc children in need|david tennant|bbc iplayer|children in need 2023|mawaan rizwan|julian bleach|davros|genesis of the daleks|fourteenth doctor|doctor who children in need|14th doctor|russell t davies,963268,47826,0,4037,https://i.ytimg.com/vi/RfLtAdSgWPQ/default.jpg,False,False,"The Doctor accidentally lands the TARDIS at a pivotal moment in the creation of his deadliest enemies... 💥Subscribe to Doctor Who for more exclusive videos: http://bit.ly/SubscribeToDoctorWho WATCH MORE: Compilations: http://bit.ly/DWCompilationsRegenerations: http://bit.ly/DWRegenerationsTitle Sequences: http://bit.ly/ALLTitleSequencesMORE ABOUT DOCTOR WHO:Welcome to the Doctor Who Channel! Travel in the TARDIS with clips dating back to the Doctor's first incarnation in 1963, all the way through dozens of regenerations. Including behind-the-scenes footage, exclusive videos and our very own show Doctor Who: The Fan Show - this is the place to find all the best official clips.#DoctorWhoThis is a commercial channel from BBC Studios. Service information and feedback:  https://www.bbcstudios.com/contact/contact-us/",Entertainment
YXt0Nw8xWh0,Tate McRae - exes (Official Video),2023-11-17T05:00:11.000Z,UC-yW8iz7ICKv_bhuxLtcJaw,TateMcRaeVEVO,tate mcrae music|tate mcrae uh oh|uh oh song|are we flying tour|tate mcrae new music|tate mcrae greedy|baby don’t get greedy|greedy sped up|tate mcrae 2023|new tate mcrae music video|tate mcrae official video|don’t come back tate mcrae|you broke me first tate mcrae|tate mcrea|tate mcrae|tatemcrea|wrote song|billie eilish|gracie abrams|olivia rodrigo|exes tate mcrae|think later album|think later tate mcrae|exes|think,1661069,93792,0,4108,https://i.ytimg.com/vi/YXt0Nw8xWh0/default.jpg,False,False,"“exes” Out Now: https://TateMcRae.lnk.to/exes   Tate McRae's new album, THINK LATER, is out December 8th. Pre-order and pre-save now! https://tatemcrae.lnk.to/THINKLATERThe THINK LATER Tour is coming to a city near you. Find tickets here: https://tatemcrae.com Follow Tate: INSTAGRAM: https://www.instagram.com/tatemcrae/ TWITTER: https://twitter.com/tatemcrae  TIKTOK: https://www.tiktok.com/@tatemcrae WEBSITE: https://www.tatemcrae.com/ Lyrics: Oh, I’m sorry, sorry that you love meChanged my mind up like it’s origamiOh, I’m sorry, sorry that you love meChanged my mind up like it’s origami K-Kisses to my exes who don’t give a shit about meKisses, kisses to the next ones who think they can live without meWe make up, then we break upThen they swear they’ll never call meBut I still keep their number and their necklaceKisses to my exesHappens every time, I don’t mean, mean to be cold, but that’s how I getOhMe and my all my prideTry to burn down every damn bridge anytime we canAnd againImma, Imma, ImmaWild ride that never stopsImma, Imma, ImmaHard case they can’t unlockAnd I, and I swearI care a lot, just not enoughLet’s just sayIt is what it is and was what it wasK-Kisses to my exes who don’t give a shit about meKisses, kisses to the next ones who think they can live without meWe make up, then we break upThen they swear they’ll never call meBut I still keep their number and their necklaceKisses to my exesOh, I’m sorry, sorry that you love meChanged my mind up like it’s origamiOh, I’m sorry, sorry that you love meChanged my mind up like it’s ori-Say, say I wanna go, then then, I wanna leaveMake another promise that I can’t keepI don’t ever know what I wantBut that’s what you wantIf you’re down, well then don’t blame meBreaking it all before it startsMaking it all up in my headBut I just overshare about things I never meantImma, Imma, ImmaWild ride that never stopsImma, Imma, ImmaHard case they can’t unlockAnd I, and I swearI care a lot, just not enoughLet’s just sayIt is what it is and was what it wasK-Kisses to my exes who don’t give a shit about meKisses, kisses to the next ones who think they can live without meWe make up, then we break upThen they swear they’ll never call meBut I still keep their number and their necklaceKisses to my exesOh, I’m sorry, sorry that you love meChanged my mind up like it’s origamiOh, I’m sorry, sorry that you love meChanged my mind up like it’s origamiKisses to my exes, I know that I did you dirtyLittle messed up, little selfishWe ain’t married, I ain’t 30Yeah we hooked up, then we broke up Then I said you really hurt meBut I still got your number and your necklaceKisses to my exesCredits: Director - Aerin MorenoCreative Director – Bradley J. CalderProduction Company - freenjoyEPs - Nathan Scherrer, Tara ShereeLabel Producer/Commissioner - Sam HoustonHead of Production - Ben PietyProducer - Aiden MagarianPM - Tori StoroshCoordinator - Ivan Zigas1st AD - Max Dean2nd AD - Lizzy WalkerDP - Cory BurmesterSteadicam - Chris LohJib Operator - Bryan Sprow1st AC - Paul Weidt2nd AC - Maud LaurentLoader - Earl DavisVTR - Evan Johnson Gaffer - Dimitri ChristoforidisACLT - Louis WeissmanBoard Operator - Tyler SandersonSLT - Evan HindsSLT - Louie CercedezSLT - Gordon HaleKey Grip - Brendan RielBBG - Connor ColbyGrip - Jerry BrownGrip - Eric FowlerGrip - Logan AlessoGrip Hyph - Wilson SunProduction Designer - Wesley GoodrichLead Man - Jon HirschLead Assist - Hunter GortonSet Dresser - Nick De La RosaSet Dresser - Michael DukowskiGraphic Designer - Phillip BraunFabrication - Strong Arm SetsCarpentry Lead - Duane RusselScenic Painter - Noelia Bello BustamenteArt Assist - Cleo CampArt Assist - B ArmstrongChoreographer - Sean BankheadTM Stylist - Joanie Del SantoTM Wardrobe Assist - Natalie SmithsonTM Makeup - Lilly KeysTM Hair - Chad WoodTM Nails - Sarah ChueCostume Designer - Ann-Marie Hoang1st Costumer - Mizuki Horigome2nd Costumer - Gabriella GilmanKey HMU - Morgan AndersenKey HMU - Jennie MonnetteHMU Assist - Destiny NashHMU Assist - Abigail SmithHMU Assist - Charlene LefeverHMU Assist - Jennifer Vanessa Barrera Dancer - Stevie DoreDancer - Tayler ReefDancer - Tacir RobersonDancer - Delaney GlazerDancer - Bailey HoltDancer - Madison SmithDancer - Joya JacksonDancer - Natalie BebkoGang Boss - Terrance MartinTalent Moho - David RoumbosCraft Services - Veronica McleanCraft Services - Karla Maria PadillaMedic - Michael Smith Office PA - Anne-Sophie BineAD PA - Chaguad SitthiphapTruck PA - Joe BlancaSet PA - Aspen MillerSet PA - Court RutterSet PA - Quincy CowherdEditor - Aerin MorenoColorist - Matt Osborne / CO3Beauty - Sunset Edit MGMT – Jeffrey AzoffMGMT - Tommy BruceMGMT - Tom SkoglundMGMT - Sali KharaziMGMT - Ali SaundersMarketing - Sam JacobsonLabel - RCA Records#TateMcRae #exes #OfficialVideo",Music
uA6f1IoUKs0,72nd MISS UNIVERSE Preliminary Competition,2023-11-16T04:15:39.000Z,UCTdxW3Si8aduSuZbzyR2jlw,Miss Universe,miss universe|Pageants|Pageant Tutorials|Beauty Pageants|Miss Universe Full Show|missuniverso|miss universe 2022|miss universo|makeup|makeup tutorial|makeup glam,8716862,117251,0,11170,https://i.ytimg.com/vi/uA6f1IoUKs0/default.jpg,False,False,"Watch the 72nd Edition of the MISS UNIVERSE Preliminary Competition, LIVE from San Salvador, El Salvador. MISS UNIVERSE 2023 will be the 72nd MISS UNIVERSE competition, to be held on November 15th, 2023 in El Salvador. R'Bonney Gabriel of USA will crown her successor at the end of the event.Learn more about the competition at http://www.missuniverse.comCheck out the Miss Universe Shop: https://shop.missuniverse.comStay Connected!Facebook: https://www.facebook.com/MissUniverseTwitter: https://www.twitter.com/MissUniverseInstagram: https://www.instagram.com/MissUniverse",Entertainment
wYdAs5yhmhk,ARGENTINA vs. URUGUAY [0-2] | RESUMEN | ELIMINATORIAS SUDAMERICANAS | FECHA 5,2023-11-17T02:51:03.000Z,UCzU8-lZlRfkV3nj0RzAZdrQ,CONMEBOL,fútbol|pelota|gol|copa|libertadores|sudamericana|eliminatorias|mundial,5021550,0,0,7998,https://i.ytimg.com/vi/wYdAs5yhmhk/default.jpg,False,True,¡Ganó #Uruguay! La Celeste venció a #Argentina en La Bombonera por la Fecha 5 de las #EliminatoriasSudamericanas. 🇺🇾🔥#CreeEnGrandeSuscríbete I Inscreva-se I Subscribe: http://bit.ly/CONMEBOLFacebook: facebook.com/CONMEBOLInstagram: instagram.com/conmebol/Twitter: twitter.com/CONMEBOL,Sports
A6Z9gkJnfgw,The real reason I left Sweden.,2023-11-16T22:30:01.000Z,UC-lHJZR3Gqxm24_Vd_AJ5Yw,PewDiePie,pewdiepie|pewds|pewdie,1746678,117825,0,7300,https://i.ytimg.com/vi/A6Z9gkJnfgw/default.jpg,False,False,#🌏AD - Get exclusive NordVPN deal here ➵ https://NordVPN.com/pewdiepie It’s risk free with Nord’s 30 day money-back guarantee!✌Stock Up On ➡️🥤Gfuel (affiliate): https://gfuel.ly/pewdiepie-collection#Code #PewdiepieOfficial ƿ૯ωძɿ૯ƿɿ૯ TikTok: https://www.tiktok.com/@pewdiepie∞ Official ƿ૯ωძɿ૯ƿɿ૯ Infinity Stream: https://www.twitch.tv/pewdiepie⚙️ My Setup (affiliate links)⚙️🎧 Headphones: https://www.anrdoezrs.net/click-100814745-14330447🪑 Chair: https://tinyurl.com/clutchpdp⌨️ 🖱️ Keyboard & Mouse: https://tinyurl.com/ghostpdp🕹️ PewDiePie's Tuber SimulatoriOS: https://tinyurl.com/tuberIOSAndroid: https://tinyurl.com/tuberandroid🕹️ PewDiePie's PixelingsiOS: https://tinyurl.com/pixelingsiOSAndroid: https://tinyurl.com/pixelingsandroid,Entertainment
aj2LKDT767Y,Secret Tunnel/Garage Update #4,2023-11-16T16:00:01.000Z,UCdmcAwbdiXQWs9d4Qd4KzDw,2 Much ColinFurze,[none],2149434,117183,0,7919,https://i.ytimg.com/vi/aj2LKDT767Y/default.jpg,False,False,WELL I'M SHOCKED..........And very Pleased.Get your MilkinTea Mugs and more https://www.colinfurzeshop.comCheck out the E30 Restoration progress https://youtube.com/@yorkshirecarrestoration?si=tcIpYwA1uspnNA9DSteel is all from https://www.barrettsteel.comFollow me on Social Media.Instagram https://www.instagram.com/realcolinfurze/Twitter https://twitter.com/colin_furzeFacebook https://www.facebook.com/Colin-furze-521680751253584TikTok https://vm.tiktok.com/JJ8wSTs/#colinfurze #tunnel #secret #update,Science & Technology
KKjIqCVFUyM,400 MPH Bowling Ball to the Dome with @howridiculous  - The Slow Mo Guys,2023-11-16T22:00:02.000Z,UCUK0HBIBWgM2c4vsPhkYY4w,The Slow Mo Guys,slomo|slow|mo|super|motion|Slow Motion|1000|1000fps|gav|dan|slowmoguys|phantom|guys|HD|flex|gavin|free|gavin free|high speed camera|the slow mo guys|2000|2000fps|5000|5000fps|bowling|ball|cannon|dome,1363857,77504,0,2795,https://i.ytimg.com/vi/KKjIqCVFUyM/default.jpg,False,False,"Gav and Dan go to Montana to meet up with Brett and Scott from @howridiculous. A collaboration 12 years in the making between 4 people who don't live in Montana! Check out their video here - https://youtu.be/M49i6CFPMmkGive this one a miss if you're slightly squeamish.  Massive shoutout to @BealsScience for the cannon work. Filmed at 82,000FPS 400 MPH Bowling Ball with How Ridiculous - The Slow Mo Guys",Entertainment
fRJ03btNsao,Bachke Bachke (Full Video) Karan Aujla I Ikky | Latest Punjabi Songs 2023,2023-11-16T04:30:12.000Z,UCm9SZAl03Rev9sFwloCdz1g,Rehaan Records,[none],9484829,138431,0,8534,https://i.ytimg.com/vi/fRJ03btNsao/default.jpg,False,False,Singer/Lyrics:/Composer -  Karan Aujla Music: IkkyVideo: Qarn MallhiLabel :Rehaan RecordsOnline promotions : LA Music Promotions CoVideo Credits:Director/DOP/Editor: Qarn MallhiCreative Director: Mani mallhi Assistant Director: Jinder Virk 2nd AD: Harji Grip: Preet NainGaffer: TD SinghBTS: Chirag Grover & JashanFemale Lead: Nikki ZechaColoring: Lucifer Media LabVideo Production: Brownwest OriginalsWebsite: WWW.RehaanRecords.CAFB: https://m.facebook.com/RehaanRecords/INSTA: Instagram/rehaanrecords,Music
2ow9mZkZa8o,"Colombia 2-1 Brasil: Resumen Extendido, goles y highlights del partido por Eliminatorias 2026",2023-11-17T02:44:23.000Z,UCvEJrtUk0C2wh3P-9DOdblA,Fanatiz,[none],769410,9327,0,564,https://i.ytimg.com/vi/2ow9mZkZa8o/default.jpg,False,False,No te pierdas los partidos de las Eliminatorias Sudamericanas 2026 EN VIVO 👉 https://fntz.co/WCQualifiersExclusive access to the best of the CONMEBOL World Cup Qualifiers in English & Spanish.Acesso exclusivo ao melhor das Eliminatórias da Copa do Mundo da CONMEBOL em inglês e espanhol.*PPVs can only be purchased via the web.👉 BUY HERE | https://fntz.co/WCQualifiersSubscribe to our YTB channel! / fanatiztv  Visit our website: https://fanatiz.comTwitter: https://twitter.com/FanatiztvInstagram: https://www.instagram.com/fanatiztv/Facebook: https://www.facebook.com/fanatiztv/TikTok: https://www.tiktok.com/@fanatiztv#fanatiz #WorldCup #WorldCup2026 #Eliminatorias #EliminatoriasSudamericanas2026 #Colombia #Brasil #Selecao #jamesRodriguez #luisDiaz Gol Luis Diaz Gol Gabriel Martinelli,Sports
TiEVqZ2Bc_c,Marvel Studios’ What If…? Season 2 | Official Trailer | Disney+,2023-11-15T17:00:24.000Z,UCvC4D8onUfXzvjTOM-dBfEA,Marvel Entertainment,marvel|comics,5977146,276916,0,10040,https://i.ytimg.com/vi/TiEVqZ2Bc_c/default.jpg,False,False,"Things have gotten a little twisted in the Multiverse…All new episodes of Marvel Studios’ #WhatIf are coming to Disney+ on December 22. Unwrap one episode every day for nine consecutive days as our gift to you!► Watch Marvel on Disney+: https://bit.ly/2XyBSIW► Subscribe to Marvel on YouTube: http://bit.ly/WeO3YJFollow Marvel on Twitter: ‪https://twitter.com/marvelLike Marvel on Facebook: ‪https://www.facebook.com/marvelWatch Marvel on Twitch: https://www.twitch.tv/marvelReward your Marvel fandom by joining Marvel Insider!Earn points, then redeem for awesome rewards.Terms and conditions apply. Learn more at https://www.marvel.com/insider?Osocial=YT&CID=MarvelInsiderFor even more news, stay tuned to:Tumblr: ‪http://marvelentertainment.tumblr.com/Instagram: https://www.instagram.com/marvelPinterest: ‪http://pinterest.com/marvelofficialReddit: http://reddit.com/u/marvel-official",Entertainment
tybKnGZRwcU,How to Win an Interstellar War,2023-11-15T15:00:01.000Z,UCsXVk37bltHxD1rDPwtNM8Q,Kurzgesagt – In a Nutshell,[none],3468028,176763,0,9557,https://i.ytimg.com/vi/tybKnGZRwcU/default.jpg,False,False,"✨ Join the Galactic Club: your cozy corner in the vast universe ✨ https://shop.kgs.link/galactic-clubGet everything you need to fit right in with our brand new Limited Drop – available worldwide, and ONLY on the kurzgesagt shop! Stocks are highly limited, so don’t delay!Sources & further reading: https://sites.google.com/view/sources-interstellarwar/Could aliens destroy us from light years away? Another day at Kurzgesagt Labs, where we answer the most important questions with science. Today: how might civilizations wage war across light years? What kind of devastating weapons could they use and what would they look like?OUR CHANNELS▀▀▀▀▀▀▀▀▀▀▀▀▀▀▀▀▀▀▀▀▀▀▀▀▀▀German:        https://kgs.link/youtubeDESpanish:        https://kgs.link/youtubeESFrench:          https://kgs.link/youtubeFRPortuguese:  https://kgs.link/youtubePTArabic:           https://kgs.link/youtubeARHindi:             https://kgs.link/youtubeHIJapanese:     https://kgs.link/youtubeJAKorean:          https://kgs.link/youtubeKOHOW CAN YOU SUPPORT US?▀▀▀▀▀▀▀▀▀▀▀▀▀▀▀▀▀▀▀▀▀▀▀▀▀▀This is how we make our living and it would be a pleasure if you support us!Get Products designed with ❤ https://shop-us.kurzgesagt.org  Join the Patreon Bird Army 🐧  https://kgs.link/patreon  DISCUSSIONS & SOCIAL MEDIA▀▀▀▀▀▀▀▀▀▀▀▀▀▀▀▀▀▀▀▀▀▀▀▀▀▀TikTok:           https://kgs.link/tiktokReddit:            https://kgs.link/redditInstagram:     https://kgs.link/instagramTwitter:           https://kgs.link/twitterFacebook:      https://kgs.link/facebookDiscord:          https://kgs.link/discordNewsletter:    https://kgs.link/newsletterOUR VOICE▀▀▀▀▀▀▀▀▀▀▀▀▀▀▀▀▀▀▀▀▀▀▀▀▀▀The Kurzgesagt voice is from Steve Taylor:  https://kgs.link/youtube-voiceOUR MUSIC ♬♪▀▀▀▀▀▀▀▀▀▀▀▀▀▀▀▀▀▀▀▀▀▀▀▀▀▀700+ minutes of Kurzgesagt Soundtracks by Epic Mountain:Spotify:            https://kgs.link/music-spotifySoundcloud:   https://kgs.link/music-soundcloudBandcamp:     https://kgs.link/music-bandcampYoutube:          https://kgs.link/music-youtubeFacebook:       https://kgs.link/music-facebookThe Soundtrack of this video:SoundCloud: https://bit.ly/3SGtmFEBandcamp: https://bit.ly/40GsseqIf you want to help us caption this video, please send subtitles to subtitle@kurzgesagt.orgYou can find info on what subtitle files work on YouTube here:https://support.google.com/youtube/answer/2734698?hl=en-GB&ref_topic=7296214Thank you!🐦🐧🐤 PATREON BIRD ARMY 🐤🐧🐦▀▀▀▀▀▀▀▀▀▀▀▀▀▀▀▀▀▀▀▀▀▀▀▀▀▀Many Thanks to our wonderful Patreons (from http://kgs.link/patreon) who support us every month and made this video possible:robek, Brad Christensen, Asija Newns, Pedro Castro Verdezoto, Lucas Watkins, damien perolle, Fab Cars, alomanola, MikyF2K, Mithilesh Hinge, okor, Lucan, The Gnome, Kyung Geun Kim, Misa Brass, Martin Hippenstiel, Morgan, Anthony Distel, Filip Rogowski, Gabe, Tobias Hofmann, Zaret, Bootools, David Earl, Ben Hamilton, still [Redacted], polyploidy, Elgenzay, Jared, Soda celeste, Felix, Benjamin Goodrich, Taher Rangwala, Jesse Barnes, WillowTree, DarkKot 686, Aaron Phillips, Luc Royal, Lukas Meier, esamoth, Smithius, Mermor, Laura Kühne, Tyler Fendone, gassi30, Andres Arce, Suzanne frounfelter, Akito Nozaki, SirRender, Space, Daniel Hofmeister, Dan M, Jacob Culp, ReyesX77, Aaron T Haltman, DJ Dubbes, SchnarcheNoah, Keira Standing, Steven Lamontagne, Bliss, David Anderson, Uhh Uhhh Uhhh, The Paul Family",Education
aQXD-Wr6h64,Why the US Military Costs so Much,2023-11-16T19:11:42.000Z,UC9RM-iSvTu1uPJb8X5yp3EQ,Wendover Productions,[none],854719,28769,0,2337,https://i.ytimg.com/vi/aQXD-Wr6h64/default.jpg,False,False,Sign up for Nebula for 40% off: https://nebula.tv/wendoverWatch the Nebula-exclusive episode about the Logistics of Arms Manufacturing: https://nebula.tv/videos/wendover-the-logistics-of-arms-manufacturing Youtube: http://www.YouTube.com/WendoverProductionsInstagram: http://Instagram.com/sam.from.wendoverTwitter: http://www.Twitter.com/WendoverProSponsorship Enquiries: wendover@standard.tvOther emails: sam@wendover.productionsReddit: http://Reddit.com/r/WendoverProductionsWriting by Sam Denby and Tristan PurdyEditing by Alexander WilliardAnimation led by Max MoserSound by Graham Haerther Thumbnail by Simon BuckmasterReferences[1] https://people.defensenews.com/top-100/  [2] https://www.lockheedmartin.com/content/dam/lockheed-martin/eo/documents/annual-reports/lockheed-martin-annual-report-2021.pdf [3] https://www.usaspending.gov/agency [4] https://sgp.fas.org/crs/natsec/R45403.pdf [5] https://www.rebootingthearsenal.com/,Education
BIBQVk6v-js,Australia 7 Day: Widespread heavy showers for QLD & NSW,2023-11-15T23:52:57.000Z,UC6J_1lbR727yUrcm9m140Ug,WeatherWatchTV,[none],172401,2106,0,211,https://i.ytimg.com/vi/BIBQVk6v-js/default.jpg,False,False,"A week of heavy downpours are on the way for dry parts of eastern Australia and while relief will again be hit and miss this is the second week full of thunderstorms and widespread showers in just the past month. El Nino tends to discourage as much rain - so right now this set up is fantastic for those who need it.*Apologies, Phil accidentally says Mt Gambier is in Victoria...when of course it's just over the state line in south-eastern South Australia!  Will make up for that next week :) Of course, as we discuss, relief isn’t for everyone with some coastal areas missing the heaviest rain as it falls inland (but hopefully hits river and water catchment areas).We cover the rain in more detail than previous updates - and as always we give you the biggest temperature ups and downs at various points around the continent.Thanks for your support and for telling your friends and family of our new Australian only 7 day outlooks - each and every Thursday exclusive to WeatherWatchTV on YouTube!",Science & Technology
